created_utc,date,title,subreddit,author,score,num_comments,url
1746397204.0,2025-05-04,PLTR: The Most Overvalued Stock in History,wallstreetbets,theycallmeryan,1524,470,https://www.reddit.com/r/wallstreetbets/comments/1kew2vw/pltr_the_most_overvalued_stock_in_history/
1746205927.0,2025-05-02,Lost 63k but still up $40 for the year lol,wallstreetbets,SaraBrew4,132,39,https://www.reddit.com/gallery/1kd6bdf
1746200829.0,2025-05-02,"$1900 to $45,000 in 3 months.",wallstreetbets,DasherLao,7277,505,https://www.reddit.com/gallery/1kd49d3
1746058798.0,2025-05-01,Mom always said she should have got me tested,wallstreetbets,Substantial_Pop9878,71,23,https://www.reddit.com/gallery/1kbvnu4
1746037736.0,2025-04-30,Everything about META's earnings tonight,wallstreetbets,DangerousBrat,47,34,https://www.reddit.com/r/wallstreetbets/comments/1kbnosv/everything_about_metas_earnings_tonight/
1745934085.0,2025-04-29,"Sold my Tesla puts at the high yesterday 15-45 minutes before the drop, love to see it.",wallstreetbets,Prize_Investment1447,286,78,https://i.redd.it/qb0ukq6f2sxe1.jpeg
1745687356.0,2025-04-26,Who will hold the last bag of Tesla?,wallstreetbets,holypally0731,590,588,https://www.reddit.com/r/wallstreetbets/comments/1k8hvr0/who_will_hold_the_last_bag_of_tesla/
1745672184.0,2025-04-26,Hertz: Here's Why I'm Planning To Get In With OTM Puts,wallstreetbets,true-dgen,149,86,https://www.reddit.com/r/wallstreetbets/comments/1k8cbl5/hertz_heres_why_im_planning_to_get_in_with_otm/
1745602436.0,2025-04-25,Tesla Puts Will Print Next Week,wallstreetbets,ineed1billiondollars,8084,540,https://i.redd.it/kz93lwi9o0xe1.jpeg
1745593691.0,2025-04-25,Placed Tesla Call 📈Wish me prints,wallstreetbets,SoulfulAcademics,15,36,https://i.redd.it/sppwcre9yzwe1.jpeg
1745530207.0,2025-04-24,Play tomorrow. $QQQ 475c 0dte and 500c 4/30,wallstreetbets,classy_coder,92,56,https://www.reddit.com/r/wallstreetbets/comments/1k73zuf/play_tomorrow_qqq_475c_0dte_and_500c_430/
1745521349.0,2025-04-24,Everything about Google's earnings tonight,wallstreetbets,DangerousBrat,250,101,https://www.reddit.com/r/wallstreetbets/comments/1k70ero/everything_about_googles_earnings_tonight/
1745464591.0,2025-04-24,"So Tesla should fall over the weekend, or am I still not getting it?",wallstreetbets,frobro122,776,483,https://www.reddit.com/r/wallstreetbets/comments/1k6ib1p/so_tesla_should_fall_over_the_weekend_or_am_i/
1745462683.0,2025-04-24,Good luck 🧑‍🦯,wallstreetbets,Prize_Investment1447,97,60,https://i.redd.it/5iuiq8dp4pwe1.jpeg
1745450958.0,2025-04-23,Checking the halving of Teslas Capital Expenditures together,wallstreetbets,Many-Shelter4175,8,73,https://www.reddit.com/r/wallstreetbets/comments/1k6dp17/checking_the_halving_of_teslas_capital/
1745440772.0,2025-04-23,Tesla is absolute 💩,wallstreetbets,Teslaismylifesavings,104,129,https://i.redd.it/f59dos6jbnwe1.jpeg
1745431156.0,2025-04-23,#AFRM LONG,wallstreetbets,ApprehensivePay6311,5,7,https://i.redd.it/s689quiyimwe1.jpeg
1745426265.0,2025-04-23,TESLA is forming a nice descending triangle. Your time is coming tesla bears!,wallstreetbets,retiredalavalathi,4120,490,https://i.redd.it/jy8wfil83mwe1.png
1745391801.0,2025-04-23,The Market didn't care about Tesla's Earnings. Here's why. TLDR? It's not rigged,wallstreetbets,Wiser-dude,6456,644,https://i.redd.it/ffoy3bji8jwe1.png
1745365729.0,2025-04-22,Tesla earnings plunge 71 percent in first quarter,wallstreetbets,WingerRules,3614,355,https://thehill.com/policy/technology/5260868-tesla-earnings-drop/
1745355797.0,2025-04-22,Tesla Earnings Breakdown: Tesla up 4.6% today with little to no movement so far in after hours...,wallstreetbets,art4353,535,203,https://i.redd.it/p39042xpagwe1.png
1745354325.0,2025-04-22,For the people who played tesla earnings.,wallstreetbets,Intelligent-Future23,5471,411,https://i.redd.it/h9ic2eig6gwe1.gif
1745352547.0,2025-04-22,TESLA - Q1 2025 Financial Results - Shareholder Deck,wallstreetbets,atx840,1257,502,https://digitalassets.tesla.com/tesla-contents/image/upload/IR/IR/TSLA-Q1-2025-Update.pdf
1745340240.0,2025-04-22,Everything about Tesla's earnings tonight,wallstreetbets,DangerousBrat,192,219,https://www.reddit.com/r/wallstreetbets/comments/1k5b0z2/everything_about_teslas_earnings_tonight/
1745338364.0,2025-04-22,TOMORROW WE SHORT TESLA 🐻,wallstreetbets,WildAmphibian6490,269,129,https://i.redd.it/o3ybv2j1vewe1.jpeg
1745337266.0,2025-04-22,Tsla YOLO,wallstreetbets,ApprehensivePay6311,20,7,https://i.redd.it/0r9agfyrrewe1.jpeg
1745244409.0,2025-04-21,100k tesla puts yolo,wallstreetbets,PutsGoUp,428,99,https://i.redd.it/djtbuovn37we1.jpeg
1745236648.0,2025-04-21,Tesla continued loss for next 5 years,wallstreetbets,azavio,1242,122,https://i.redd.it/ta0g4i5lg6we1.jpeg
1745210332.0,2025-04-21,Tesla earnings strategy for a sell off then rally,wallstreetbets,crazyrichmaya,114,97,https://www.reddit.com/r/wallstreetbets/comments/1k458v9/tesla_earnings_strategy_for_a_sell_off_then_rally/
1745208923.0,2025-04-21,🚨TESLA DD - THE MYTH OF “BOUNCING ON BAD EARNINGS” IS DEAD 🚨 (aka why this quarter is set up for a bloodbath),wallstreetbets,LongBeach_Native,310,136,https://i.redd.it/wu38xg6564we1.jpeg
1745162270.0,2025-04-20,Tesla earnings this week,wallstreetbets,LVL1NPC-JK,612,279,https://www.reddit.com/r/wallstreetbets/comments/1k3ou80/tesla_earnings_this_week/
1745009605.0,2025-04-18,You Dont Say? TSLA DELAY,wallstreetbets,LongBeach_Native,3724,418,https://www.reuters.com/business/autos-transportation/tesla-delay-us-launch-affordable-ev-lower-cost-model-y-sources-say-2025-04-18/
1744996093.0,2025-04-18,52k gain from tesla bear,wallstreetbets,Perfect-Ad-9182,226,58,https://www.reddit.com/gallery/1k2a2mm
1744944994.0,2025-04-18,"I might print on monday, mainly tesla play",wallstreetbets,doombos,52,54,https://i.redd.it/axj7m5ecdive1.png
1744925658.0,2025-04-17,"Slow and steady wins the race, not a single red day yet this year.",wallstreetbets,DestroyYesterday,2537,244,https://i.redd.it/xwile5rurgve1.jpeg
1744897925.0,2025-04-17,Forecasting Tesla's Earnings Q&A,wallstreetbets,TopherBrennan,85,85,https://www.reddit.com/r/wallstreetbets/comments/1k1dbj3/forecasting_teslas_earnings_qa/
1744773770.0,2025-04-16,TSLA News : Puts or Calls?,wallstreetbets,KeyKindheartedness34,382,144,https://www.reddit.com/gallery/1k0atig
1744691172.0,2025-04-15,Tariff relief for car companies might be coming,wallstreetbets,StocksTok,411,106,https://finance.yahoo.com/news/auto-stocks-pop-as-trump-says-hes-looking-at-something-to-help-car-companies-with-tariffs-180127851.html
1744390887.0,2025-04-11,Great start to the month,wallstreetbets,Longjumping_Trade167,39,7,https://i.redd.it/cs1o3kepl8ue1.jpeg
1744344882.0,2025-04-11,Tesla suspends taking new orders for Model S and Model X on Chinese website,wallstreetbets,NewSlinger,1826,172,https://www.reuters.com/business/autos-transportation/tesla-suspends-taking-new-orders-model-s-model-x-chinese-website-2025-04-11/
1744302711.0,2025-04-10,I sold my Tesla puts… sorry‼️‼️,wallstreetbets,DasherLao,1130,62,https://www.reddit.com/gallery/1jw26zl
1744301968.0,2025-04-10,WSB Instinct,wallstreetbets,zeddeii,26,5,https://i.redd.it/7ara5mya91ue1.jpeg
1744298765.0,2025-04-10,"$10,000 all in for Tesla puts.",wallstreetbets,DasherLao,1755,278,https://i.redd.it/bhfhbqwrz0ue1.jpeg
1744296503.0,2025-04-10,Continuing my play : 60k Tesla 250 puts gain.,wallstreetbets,classy_coder,25,7,https://www.reddit.com/r/wallstreetbets/comments/1jvzqpx/continuing_my_play_60k_tesla_250_puts_gain/
1744226350.0,2025-04-09,Repost: It's all about China,wallstreetbets,semantic_finance,2271,618,https://www.reddit.com/r/wallstreetbets/comments/1jve93c/repost_its_all_about_china/
1744220530.0,2025-04-09,"You can call me Mr prediction , see ya guys tomorrow.",wallstreetbets,Externox,17,35,https://www.reddit.com/gallery/1jvbugc
1744186162.0,2025-04-09,It looks like somebody saved Musk from a margin call in 2022,wallstreetbets,TopherBrennan,381,40,https://www.reddit.com/r/wallstreetbets/comments/1jv0l7a/it_looks_like_somebody_saved_musk_from_a_margin/
1744144925.0,2025-04-08,Dow Jones will double in value in the next two years,wallstreetbets,void_pe3r,0,75,https://www.reddit.com/r/wallstreetbets/comments/1juo0n8/dow_jones_will_double_in_value_in_the_next_two/
1744139667.0,2025-04-08,Had us in the first half not gunna lie,wallstreetbets,InterviewShot9979,807,72,https://www.reddit.com/gallery/1julwt0
1744138144.0,2025-04-08,"Puts on Tesla, witness me.",wallstreetbets,0Tyrael0,1792,151,https://i.redd.it/eo8gdn26qnte1.jpeg
1744069492.0,2025-04-07,16k against the market on Tesla and meta,wallstreetbets,Externox,130,210,https://i.redd.it/fhzf33712ite1.jpeg
1743996533.0,2025-04-07,Doing call before the  Tariffs stupid move,wallstreetbets,Externox,218,52,https://i.redd.it/3zexwd631cte1.jpeg
1743966698.0,2025-04-06,"Tesla bull slashes stock price target 43%, citing Musk and Trump",wallstreetbets,callsonreddit,2998,487,https://www.reddit.com/r/wallstreetbets/comments/1jt1wa9/tesla_bull_slashes_stock_price_target_43_citing/
1743789187.0,2025-04-04,Tired of winning Mr Trump,wallstreetbets,RazzmatazzFair5320,2,5,https://www.reddit.com/gallery/1jri4yd
1743787724.0,2025-04-04,"Lost $7,200 in TSLA... in 28 minutes.",wallstreetbets,LifeIsYoursLiveIt,12635,887,https://www.reddit.com/gallery/1jrhkc2
1743745469.0,2025-04-04,+200k Dancing With The Devil,wallstreetbets,Mr_Kush_Bush,32,6,https://www.reddit.com/gallery/1jr4oe5
1743738744.0,2025-04-04,Next play. $TSLA 250 puts.,wallstreetbets,classy_coder,164,156,https://i.redd.it/n1rc2s3ppqse1.png
1743623043.0,2025-04-02,TSLA is still on the up and up 🚀,wallstreetbets,MitchellJKumstein,0,21,https://www.reddit.com/gallery/1jpxtwh
1743609343.0,2025-04-02,Rivian posts sharp fall in quarterly deliveries as soft demand weighs,wallstreetbets,callsonreddit,242,89,https://finance.yahoo.com/news/rivian-reports-fall-first-quarter-123133853.html
1743608301.0,2025-04-02,Tesla shares rise on unconfirmed report Elon Musk could be leaving DOGE post soon,wallstreetbets,HighwayWilderness,3662,817,https://www.cnbc.com/2025/04/02/tesla-shares-rise-on-unconfirmed-report-elon-musk-could-be-leaving-doge-post-soon.html
1743601000.0,2025-04-02,$4.5k gain on TSLA puts. And to all the people that doubted me suck my balls.,wallstreetbets,DICK_STUCK_IN_COW,733,158,https://www.reddit.com/gallery/1jpoq6l
1743599117.0,2025-04-02,"Tesla first quarter deliveries: 336,681 delivered, 362,615 produced",wallstreetbets,JackDragon,7351,1153,https://ir.tesla.com/press-release/tesla-first-quarter-2025-production-deliveries-and-deployments
1743574473.0,2025-04-02,"~15k TSLA puts, holding since 2 month now. Today could be the day.",wallstreetbets,stifmaster69s,274,75,https://i.redd.it/vz3ujw6x5dse1.png
1743540103.0,2025-04-01,Almost $15k in TSLA puts let’s hope for the best (or worst),wallstreetbets,DICK_STUCK_IN_COW,390,321,https://i.redd.it/tvp3gezvbase1.jpeg
1743450115.0,2025-03-31,TSLA to the moon🚀🌕”,wallstreetbets,MitchellJKumstein,0,26,https://i.redd.it/c1cs7dk5w2se1.jpeg
1743098770.0,2025-03-27,Im glad for trailing stops TSLA Gains,wallstreetbets,luzzi5luvmywatches,48,21,https://www.reddit.com/gallery/1jladhp
1743037241.0,2025-03-27,$VTS Vitesse Energy my exotic plan to a 10 baggers (maybe),wallstreetbets,Advanced-Ad-9186,26,16,https://www.reddit.com/gallery/1jkryfy
1742958700.0,2025-03-26,"Canada freezes Tesla rebate payments, excludes company from future programs",wallstreetbets,fenriswulfwsb,6165,348,https://ca.news.yahoo.com/canada-freezes-tesla-rebate-payments-231257713.html
1742920308.0,2025-03-25,Financial times tones down its claims about a $1.4 billion misstatement in Tesla's cash flow,wallstreetbets,NewOil7911,2238,233,https://www.reddit.com/r/wallstreetbets/comments/1jjnkpi/financial_times_tones_down_its_claims_about_a_14/
1742822541.0,2025-03-24,"Volkswagen, BMW group electric cars outsell Tesla in Europe in February",wallstreetbets,callsonreddit,4210,304,https://finance.yahoo.com/news/volkswagen-bmw-group-electric-cars-114132432.html
1742655993.0,2025-03-22,Can a Tesla advocate please explain how to justify the current P/E?,wallstreetbets,EKEEFE41,3471,1390,https://www.reddit.com/r/wallstreetbets/comments/1jhai40/can_a_tesla_advocate_please_explain_how_to/
1742592287.0,2025-03-21,This was bound to happen,wallstreetbets,ThrowRA-0a,102,49,https://i.redd.it/2iz7yqlj14qe1.jpeg
1742581496.0,2025-03-21,"Nice to meet you, my name's Regarded",wallstreetbets,_MichaelHawk,449,130,https://i.redd.it/bjhtwzig53qe1.jpeg
1742511065.0,2025-03-20,Bandwagon jumper,wallstreetbets,LargeNorth2115,29,45,https://i.redd.it/hv5f5w21cxpe1.png
1742497862.0,2025-03-20,It’s time to call bullshit,wallstreetbets,AdamHorn8,3213,1233,https://www.reddit.com/r/wallstreetbets/comments/1jfwuvf/its_time_to_call_bullshit/
1742496624.0,2025-03-20,Lyft to Offer Driverless Ride-Hails ‘as Soon as This Summer’,wallstreetbets,callsonreddit,130,41,https://finance.yahoo.com/news/lyft-offer-driverless-ride-hails-175137007.html
1742492666.0,2025-03-20,The Secretary of Commerce is now recommending you buy specific stocks.,wallstreetbets,ValuableKill,26676,2321,https://www.reddit.com/r/wallstreetbets/comments/1jfuqze/the_secretary_of_commerce_is_now_recommending_you/
1742466449.0,2025-03-20,"Tesla to recall more than 46,000 Cybertrucks due to exterior panel issue",wallstreetbets,PumpkinOne6486,4694,376,https://finance.yahoo.com/news/tesla-recall-over-46-000-091416983.html
1742423338.0,2025-03-19,What's TSLA worth in a fire sale?,wallstreetbets,TopherBrennan,465,486,https://www.reddit.com/r/wallstreetbets/comments/1jf9qq8/whats_tsla_worth_in_a_fire_sale/
1742401614.0,2025-03-19,Tesla stock rebounds as California approves initial permit for ride-hailing,wallstreetbets,callsonreddit,0,64,https://finance.yahoo.com/news/tesla-stock-rebounds-as-california-approves-initial-permit-for-ride-hailing-153336137.html
1742321555.0,2025-03-18,TSLA puts gains. Time to go buy a Tesla.,wallstreetbets,brokenb3ar,188,94,https://i.redd.it/iuy8iwpiohpe1.jpeg
1742320259.0,2025-03-18,Always Diversify,wallstreetbets,XB0XRecordThat,639,70,https://i.redd.it/7qjnhyblkhpe1.jpeg
1742299202.0,2025-03-18,128 shares of tesla,wallstreetbets,AxemanFromMA,0,107,https://www.reddit.com/gallery/1je39ep
1742266855.0,2025-03-18,How to lose 17% with TSLA puts today,wallstreetbets,Simple_Eye_5400,207,108,https://i.redd.it/hxxopbav5dpe1.jpeg
1741990108.0,2025-03-14,[Fortune] Elon Musk's Tesla reportedly halts Cybertruck deliveries as owners complain of metal sides falling off,wallstreetbets,ShirlLotJack,24601,1095,https://fortune.com/2025/03/14/elon-musk-tesla-cybertruck-delivery-halt-owners-complain-of-metal-sides-falling-off/
1741983335.0,2025-03-14,I heard there’s a robot coming though ?,wallstreetbets,votalic,121,158,https://i.redd.it/i9sph6dtqpoe1.jpeg
1741978566.0,2025-03-14,Doordash expectations,wallstreetbets,erwin4200,52,54,https://www.reddit.com/r/wallstreetbets/comments/1jbbah8/doordash_expectations/
1741839211.0,2025-03-13,"60K TSLA puts, down 34%, hopes are up 43%",wallstreetbets,zeddeii,375,360,https://i.redd.it/garkevb8udoe1.png
1741810982.0,2025-03-12,TSLA IS PLAYING WITH FIRE,wallstreetbets,Top-Spirit9807,4748,901,https://www.reddit.com/r/wallstreetbets/comments/1j9tvrt/tsla_is_playing_with_fire/
1741758296.0,2025-03-12,AI trade simply out of juice or starting to deflate?,wallstreetbets,kico_kico,28,49,https://www.reddit.com/r/wallstreetbets/comments/1j9cirg/ai_trade_simply_out_of_juice_or_starting_to/
1741755782.0,2025-03-12,"60K TSLA puts, 50K of which from previous TSLA puts",wallstreetbets,zeddeii,204,112,https://i.redd.it/ngcbl1eqx6oe1.png
1741664135.0,2025-03-11,Sold this right before Tesla had its worst day in 5 years LMAO,wallstreetbets,Honest-Handle-7282,1759,118,https://i.redd.it/1t6ms4imdzne1.png
1741651378.0,2025-03-11,Tesla Puts $240 4/4. Tempted to take profit,wallstreetbets,No_Kitchen_9581,125,75,https://www.reddit.com/gallery/1j8djjd
1741648154.0,2025-03-10,Your favorite 🌈🐻 +80k,wallstreetbets,Goldinismyname,341,50,https://www.reddit.com/gallery/1j8cd3q
1741643049.0,2025-03-10,TSLA Put Gang,wallstreetbets,MosaicLifestyle,891,83,https://i.redd.it/1f373bkhmxne1.jpeg
1741641309.0,2025-03-10,Thanks wsb for the regarded yolos,wallstreetbets,Starrysteven,189,38,https://www.reddit.com/gallery/1j89n99
1741640401.0,2025-03-10,Thanks Elon,wallstreetbets,evmaisel,52,7,https://www.reddit.com/gallery/1j899xz
1741635352.0,2025-03-10,Tesla shorts gain,wallstreetbets,Boring_Building_,308,34,https://www.reddit.com/gallery/1j879xb
1741633590.0,2025-03-10,Do I sell my Tesla puts now or hold?,wallstreetbets,alexthewook,698,426,https://i.redd.it/x8ccswguuwne1.png
1741615984.0,2025-03-10,I'm all in today,wallstreetbets,FizzBuzz888,2562,431,https://www.reddit.com/r/wallstreetbets/comments/1j7zju7/im_all_in_today/
1741196527.0,2025-03-05,Tesla signs first lease deal in India,wallstreetbets,papa_elon007,0,52,https://www.reddit.com/r/wallstreetbets/comments/1j48v4o/tesla_signs_first_lease_deal_in_india/
1741026351.0,2025-03-03,11k last month on Tesla Puts,wallstreetbets,darth_knuth,132,22,https://i.redd.it/920xnkm7pime1.jpeg
1740644582.0,2025-02-27,🐻🐻🐻TSLA 6th day in a row?,wallstreetbets,ICantDive,43,44,https://i.redd.it/ikefzdm06nle1.jpeg
1740621145.0,2025-02-27,-24k loss Tesla,wallstreetbets,Imzyfed,1151,693,https://i.redd.it/6w73maub8lle1.jpeg
1740615549.0,2025-02-27,"Big Tech - Net Income, Operating Income, and EBITDA (updated with Nvidia earnings)",wallstreetbets,Prudent-Corgi3793,264,91,https://www.reddit.com/gallery/1iz2ns1
1740604228.0,2025-02-26,"Thank you for being a Tool, Elon Musk",wallstreetbets,Waste-Skin338,635,62,https://www.reddit.com/gallery/1iyye5e
1740598222.0,2025-02-26,Betting on tails and also not heads,wallstreetbets,turbo_gunter,58,9,https://i.redd.it/nfcu08z5cjle1.jpeg
1740583767.0,2025-02-26,"Short Tesla, Long Rivian",wallstreetbets,DeepFeckinAlpha,424,122,https://i.redd.it/y1j1h4n65ile1.jpeg
1740570516.0,2025-02-26,HIDDEN BEHEMOTH V2: NIO,wallstreetbets,1Darkhaos,129,77,https://i.redd.it/9jp21v3s1hle1.jpeg
1740518739.0,2025-02-25,I call it “The Put Portfolio” +44k,wallstreetbets,Goldinismyname,585,52,https://i.redd.it/lfhe9mltrcle1.jpeg
1740506386.0,2025-02-25,Was down to my last 3k -> (17k) Tesla and spy poots,wallstreetbets,GoldenKrylon,89,22,https://i.redd.it/ovbqehz2rble1.jpeg
1740162821.0,2025-02-21,6 months of trading +107k 💰,wallstreetbets,Goldinismyname,60,8,https://www.reddit.com/gallery/1iuy180
1740161331.0,2025-02-21,Rivian (RIVN) Earnings Review - Bullish,wallstreetbets,DeepFeckinAlpha,39,22,https://i.redd.it/cvbglmu19jke1.jpeg
1740156970.0,2025-02-21,Rivian $6.6B Loan from DOE Will Likely Be Cut,wallstreetbets,CashFlowOrBust,137,77,https://i.redd.it/afkorse3wike1.jpeg
1740153474.0,2025-02-21,"Tesla recalls 380,000 vehicles in US over power steering assist issue",wallstreetbets,Durable_me,1925,162,https://www.reuters.com/business/autos-transportation/tesla-recalls-380000-vehicles-us-over-power-steering-issue-2025-02-21/
1740118414.0,2025-02-21,Nissan surges on report Japan group may seek Tesla investment,wallstreetbets,Sad_Story_4714,344,126,https://www.bloomberg.com/news/articles/2025-02-21/nissan-surges-on-report-japan-group-may-seek-tesla-investment
1740096292.0,2025-02-21,Caught PLTR puts right before the drop 1362%,wallstreetbets,Goldinismyname,293,12,https://www.reddit.com/gallery/1iudhkc
1739869933.0,2025-02-18,Citadel/Ken Griffin boosts GOOG position by 135% to $448M,wallstreetbets,Purple-Ad-1231,788,105,https://www.reddit.com/r/wallstreetbets/comments/1is8nl9/citadelken_griffin_boosts_goog_position_by_135_to/
1739806580.0,2025-02-17,BlackBerry: A Legacy Stock That’s Going To Get Re-Rated And Run,wallstreetbets,NYCandrun,1471,573,https://www.reddit.com/r/wallstreetbets/comments/1irml3j/blackberry_a_legacy_stock_thats_going_to_get/
1739571136.0,2025-02-14,"Bridgewater is Betting on TSLA, Dumps GS and Buys More MRNA",wallstreetbets,rightlibcapitalist,19,18,https://www.reddit.com/r/wallstreetbets/comments/1ipmhfx/bridgewater_is_betting_on_tsla_dumps_gs_and_buys/
1739545120.0,2025-02-14,UPDATE ON 500k TSLA SOLD,wallstreetbets,Useless_Rat,50,8,https://i.redd.it/oyh0aamlc4je1.png
1739544237.0,2025-02-14,ROKU - finally in plus after over three and a half years,wallstreetbets,LittleBunnyLongLeg,28,7,https://i.redd.it/49f7yre4a4je1.jpeg
1739398640.0,2025-02-12,Am I cooked?,wallstreetbets,ibhenry,1533,932,https://www.reddit.com/gallery/1io3g8w
1739395868.0,2025-02-12,$INTC The most hated 10 bagger that will make grandma proud,wallstreetbets,Mindless_Ad_8215,102,72,https://i.redd.it/uprybz6y0sie1.jpeg
1739349365.0,2025-02-12,Magnificent Eight - Net Income Comparison,wallstreetbets,Prudent-Corgi3793,4688,441,https://i.redd.it/ragrngmh6oie1.png
1739345504.0,2025-02-12,50k to 180k in 6 months - Thanks Elon,wallstreetbets,azarbillie,105,47,https://www.reddit.com/gallery/1inlnet
1739326449.0,2025-02-12,6 months trading - 85k,wallstreetbets,Goldinismyname,613,102,https://www.reddit.com/gallery/1ing9e7
1739310787.0,2025-02-11,TSLA 🩳 Gain 💰,wallstreetbets,Goldinismyname,773,95,https://i.redd.it/ku9ll8iyzkie1.jpeg
1739304152.0,2025-02-11,I LOVE TSLA PUTS TUESDAY ™️ 🤑,wallstreetbets,Scrap_Of_Doggerel,125,31,https://i.redd.it/dzlajkc8gkie1.jpeg
1739292100.0,2025-02-11,"Bought 1/31, if only i didn’t buy so far dated…",wallstreetbets,ChosenPrince,37,31,https://i.redd.it/ogcog99egjie1.jpeg
1739243334.0,2025-02-11,Kimbal Musk sells Tesla stock worth $27.6 million,wallstreetbets,WienerSalad1,5492,312,https://m.investing.com/news/insider-trading-news/kimbal-musk-sells-tesla-stock-worth-276-million-93CH-3860446?ampMode=1
1739242679.0,2025-02-11,Carvana's extremely high P/E Ratio,wallstreetbets,BigAbbreviations9098,44,72,https://www.reddit.com/r/wallstreetbets/comments/1imon8s/carvanas_extremely_high_pe_ratio/
1739227226.0,2025-02-10,"Two hours ago I posted online that someone asked me to sell. I said I d think about it tomorrow. Two hours later, the profit tripled",wallstreetbets,compmortte,155,54,https://i.redd.it/4dpxudse3eie1.png
1739218521.0,2025-02-10,It s already 89k in profit I d like to keep holding it again like a gamble. It's so fucking exciting！,wallstreetbets,compmortte,11,32,https://www.reddit.com/r/wallstreetbets/comments/1imfuhw/it_s_already_89k_in_profit_i_d_like_to_keep/
1739216432.0,2025-02-10,YOLO 25K TSLA 2X Inverse ETF,wallstreetbets,vmspionage,40,51,https://i.redd.it/cb0cly8e7die1.jpeg
1739201437.0,2025-02-10,"Five minutes, $16,700.
Same as my ejaculation. It's fucking awesome.",wallstreetbets,diffvinra,2172,211,https://www.reddit.com/gallery/1im8qph
1739053824.0,2025-02-08,this was last Friday. I would have been fine if someone didn't decide to buy a ton of stocks and put that middle finger onto tesla's curve.,wallstreetbets,Interloper_Mango,35,6,https://v.redd.it/q2yc1lyfrzhe1
1739031176.0,2025-02-08,GOOG DD,wallstreetbets,adlibwaltz,569,118,https://www.reddit.com/r/wallstreetbets/comments/1ikqr6r/goog_dd/
1738964596.0,2025-02-07,I LOVE TRUMP TARIFF FRIDAYS™️ 🤑,wallstreetbets,Scrap_Of_Doggerel,152,34,https://i.redd.it/imy76t0keshe1.jpeg
1738953702.0,2025-02-07,Tesla and the mark to market cliff,wallstreetbets,agostinho79,15,18,https://www.reddit.com/r/wallstreetbets/comments/1ik29w3/tesla_and_the_mark_to_market_cliff/
1738944304.0,2025-02-07,This was my first trade,wallstreetbets,OkShepherdiezistupid,17,8,https://www.reddit.com/gallery/1ijyfnm
1738943541.0,2025-02-07,Magnificent 7,wallstreetbets,0mica0,4036,156,https://i.redd.it/2smdlwqvnqhe1.png
1738942884.0,2025-02-07,Elon Musk's Brother Kimbal Musk And Other Tesla Execs Sell Over $73 Million In Stock - Tesla (NASDAQ:TSLA),wallstreetbets,TotherCanvas249,5648,364,https://www.benzinga.com/tech/25/02/43557967/elon-musks-brother-kimbal-musk-and-other-tesla-execs-sell-over-73-million-in-stock
1738937211.0,2025-02-07,"More electric cars sold in Europe, but Tesla takes hits everywhere",wallstreetbets,Weary-Examination-30,1143,299,https://www.reddit.com/r/wallstreetbets/comments/1ijvr82/more_electric_cars_sold_in_europe_but_tesla_takes/
1738912772.0,2025-02-07,"Magnificent 7 - Valuation, Growth, and Margins",wallstreetbets,Prudent-Corgi3793,823,140,https://i.redd.it/1xdx5zjg4ohe1.jpeg
1738837063.0,2025-02-06,DD: Big Bear AI ($BBAI) - palantir 2.0,wallstreetbets,Davidovv,339,169,https://www.reddit.com/r/wallstreetbets/comments/1iizdo7/dd_big_bear_ai_bbai_palantir_20/
1738693758.0,2025-02-04,"$5,500 -> $22,000 on Tesla",wallstreetbets,Sweaty_War7347,59,9,https://i.redd.it/b4efjw9716he1.jpeg
1738633234.0,2025-02-04,I hold both $PLTR Palantir and $BB Blackberry. Why I'm confident Blackberry will be the next Palantir,wallstreetbets,anono87,82,127,https://www.reddit.com/r/wallstreetbets/comments/1ih6aa7/i_hold_both_pltr_palantir_and_bb_blackberry_why/
1738626780.0,2025-02-03,Tesla Sales Plunge 63% in EU’s Second-Biggest EV Market,wallstreetbets,droi86,12195,684,https://www.bloomberg.com/news/articles/2025-02-03/tesla-sales-plunge-63-in-france-the-eu-s-second-biggest-ev-market?leadSource=reddit_wall
1738621178.0,2025-02-03,TSLA 02/14 $412.5 Put. $75k - $188k,wallstreetbets,AnonThrowAway072023,59,10,https://www.reddit.com/gallery/1ih1tym
1738616585.0,2025-02-03,TSLA random put buy,wallstreetbets,audioinyourface,36,14,https://i.redd.it/oyihkppqnzge1.jpeg
1738612788.0,2025-02-03,"Biggest Month Yet 62k in gains: Fat HIMS Gains, Netflix Tendies, and Enough Blue Pills to Outlast a Gay Bear Orgy",wallstreetbets,xTooGoDLy,42,24,https://www.reddit.com/gallery/1igycr9
1738604379.0,2025-02-03,Tesla's marketshare of new cars sold in Norway fell by 61% from 2024 to January 2025.,wallstreetbets,Kill_4209,4035,443,https://www.reddit.com/gallery/1iguu3e
1738536802.0,2025-02-02,You all are overlooking a giant opportunity—Google!,wallstreetbets,et_tu_bro,588,248,https://i.redd.it/f9kzh2ai2tge1.jpeg
