created_utc,date,title,subreddit,author,score,num_comments,url
1746364930.0,2025-05-04,Tesla stock makes absolutely no sense,investing,Msqueefmaker,307,391,https://www.reddit.com/r/investing/comments/1kejomo/tesla_stock_makes_absolutely_no_sense/
1746062349.0,2025-05-01,Tesla Board Opened Search for a CEO to Succeed Elon Musk,investing,TechSMR2018,1365,191,https://www.reddit.com/r/investing/comments/1kbwtoq/tesla_board_opened_search_for_a_ceo_to_succeed/
1745976028.0,2025-04-30,Why is Tesla stock slowly rising?,investing,dover_oxide,82,229,https://www.reddit.com/r/investing/comments/1kb4hm5/why_is_tesla_stock_slowly_rising/
1745884926.0,2025-04-29,Is PLTR or TSLA a Better Position for AI Growth???,investing,Fearless-Cellist-245,0,21,https://www.reddit.com/r/investing/comments/1kaai3b/is_pltr_or_tsla_a_better_position_for_ai_growth/
1745745431.0,2025-04-27,Secondary effects of a recession,investing,lllllll22,56,37,https://www.reddit.com/r/investing/comments/1k8zv18/secondary_effects_of_a_recession/
1745699922.0,2025-04-26,Sold all my Tesla shares before the crash. Here’s why I still think that was the right call (even at today's price),investing,bumpgrind,387,251,https://www.reddit.com/r/investing/comments/1k8mm3o/sold_all_my_tesla_shares_before_the_crash_heres/
1745682650.0,2025-04-26,Quarterly revenue of Tesla since 2011,investing,mat025,0,53,https://www.reddit.com/r/investing/comments/1k8g1xj/quarterly_revenue_of_tesla_since_2011/
1745452998.0,2025-04-24,Should I add extra $600 a month to mortgage or invest and save!!,investing,Momof-3DDDs,35,90,https://www.reddit.com/r/investing/comments/1k6ef29/should_i_add_extra_600_a_month_to_mortgage_or/
1745356578.0,2025-04-22,Tesla reports 20% Q1 drop in auto revenue,investing,dividebyoh,3840,466,https://www.reddit.com/r/investing/comments/1k5htk8/tesla_reports_20_q1_drop_in_auto_revenue/
1745330929.0,2025-04-22,Tesla has an earnings call later today — thoughts?,investing,naturalhairtingz,273,243,https://www.reddit.com/r/investing/comments/1k5789p/tesla_has_an_earnings_call_later_today_thoughts/
1744906443.0,2025-04-17,The best days of Big Tech are over,investing,Professional-Tax673,0,17,https://www.reddit.com/r/investing/comments/1k1gpja/the_best_days_of_big_tech_are_over/
1744496211.0,2025-04-12,"Investing in EV vehicles, suggestions for other companies.",investing,neryl08,9,31,https://www.reddit.com/r/investing/comments/1jxswmk/investing_in_ev_vehicles_suggestions_for_other/
1744395828.0,2025-04-11,Dollar cost averaging question,investing,Brassmonkay3,4,23,https://www.reddit.com/r/investing/comments/1jwwtpb/dollar_cost_averaging_question/
1744170370.0,2025-04-09,Crude oil an investment with price floor,investing,TheCuriousBread,3,12,https://www.reddit.com/r/investing/comments/1juwpro/crude_oil_an_investment_with_price_floor/
1744090345.0,2025-04-08,How China’s Restrictions on Rare Earth Mineral Exports would Affect the EV Industry,investing,kmmeow1,7,2,https://www.reddit.com/r/investing/comments/1ju68ef/how_chinas_restrictions_on_rare_earth_mineral/
1744043150.0,2025-04-07,Will the sentiment around Trump & his tariffs affect Tesla’s stock specifically?,investing,iD-10T_usererror,0,3,https://www.reddit.com/r/investing/comments/1jtpf5k/will_the_sentiment_around_trump_his_tariffs/
1744009594.0,2025-04-07,Congratulations if you shorted Tesla.,investing,Soggy-Bad2130,747,293,https://www.reddit.com/r/investing/comments/1jtfari/congratulations_if_you_shorted_tesla/
1743812749.0,2025-04-05,Rocket Lab (RKLB): A Promising Space Stock for the Post-Musk Era,investing,cheese_and_toasted,2,15,https://www.reddit.com/r/investing/comments/1jrqzht/rocket_lab_rklb_a_promising_space_stock_for_the/
1743791844.0,2025-04-04,Tariffs & Tesla- Will the hit affect sentiment around Tesla? And are you a goldfish?,investing,iD-10T_usererror,0,1,https://www.reddit.com/r/investing/comments/1jrj6vf/tariffs_tesla_will_the_hit_affect_sentiment/
1743781607.0,2025-04-04,Why has BYD stock been going down significantly?,investing,cakewalk093,3,32,https://www.reddit.com/r/investing/comments/1jrf409/why_has_byd_stock_been_going_down_significantly/
1743780005.0,2025-04-04,Need some advice on what to do with my portfolio.,investing,Boring_Most_5343,1,4,https://www.reddit.com/r/investing/comments/1jregt3/need_some_advice_on_what_to_do_with_my_portfolio/
1743705854.0,2025-04-03,How are you guys feeling today after seeing your portfolios :(,investing,malife89,347,614,https://www.reddit.com/r/investing/comments/1jqqk4w/how_are_you_guys_feeling_today_after_seeing_your/
1743268172.0,2025-03-29,Should I keep SCHD in my portfolio?,investing,Popster962,8,82,https://www.reddit.com/r/investing/comments/1jmr0ou/should_i_keep_schd_in_my_portfolio/
1743014461.0,2025-03-26,Which publicly listed companies are best positioned for 2050?,investing,TheKajin,0,34,https://www.reddit.com/r/investing/comments/1jkj67g/which_publicly_listed_companies_are_best/
1742958980.0,2025-03-26,When you buy stocks are you investing in the company directly and thus they benefit?,investing,xboxhaxorz,46,61,https://www.reddit.com/r/investing/comments/1jk2efe/when_you_buy_stocks_are_you_investing_in_the/
1742945922.0,2025-03-25,"BREAKING: Fraud investigation into Tesla continues, $43M in government rebate payments paused and company banned from all Canadian EV rebate and grant programs",investing,Mountain-Taro-123,6062,207,https://www.reddit.com/r/investing/comments/1jjxy7e/breaking_fraud_investigation_into_tesla_continues/
1742840903.0,2025-03-24,Opening an individual brokerage account,investing,Naive-Deer2116,0,6,https://www.reddit.com/r/investing/comments/1jixx9v/opening_an_individual_brokerage_account/
1742674590.0,2025-03-22,Hwy this is a heads up there is a right wing troll trying to get people to make what even i would consider a risky move on TSLA,investing,NaiveLandscape8744,185,82,https://www.reddit.com/r/investing/comments/1jhhlla/hwy_this_is_a_heads_up_there_is_a_right_wing/
1742572936.0,2025-03-21,TSLA Fair Value Analysis: The bull The Bear . The case for the 140 and 180 Valuation,investing,NaiveLandscape8744,0,20,https://www.reddit.com/r/investing/comments/1jgkamz/tsla_fair_value_analysis_the_bull_the_bear_the/
1742442662.0,2025-03-20,Is anyone annoyed by Dan Ives?,investing,Adventurous-Bet-9640,32,44,https://www.reddit.com/r/investing/comments/1jfg9nh/is_anyone_annoyed_by_dan_ives/
1742399256.0,2025-03-19,Lutnick’s Cantor Upgrades Rating on Musk’s Tesla to a Buy,investing,Jielin41,294,100,https://www.reddit.com/r/investing/comments/1jf03hk/lutnicks_cantor_upgrades_rating_on_musks_tesla_to/
1742325021.0,2025-03-18,Advice for how to relay the economy to my parents,investing,Baader_Meinhof9,0,25,https://www.reddit.com/r/investing/comments/1jed2t8/advice_for_how_to_relay_the_economy_to_my_parents/
1742226160.0,2025-03-17,Why only trade TSLQ daily (Tesla short),investing,badharp,0,13,https://www.reddit.com/r/investing/comments/1jdfpm1/why_only_trade_tslq_daily_tesla_short/
1742219356.0,2025-03-17,Anatomy of gas lighting investors,investing,-Lorne-Malvo-,168,86,https://www.reddit.com/r/investing/comments/1jdd2hh/anatomy_of_gas_lighting_investors/
1742214522.0,2025-03-17,Motley Fool 630X Decade - A Midterm Review,investing,Thomas-O,34,20,https://www.reddit.com/r/investing/comments/1jdbg65/motley_fool_630x_decade_a_midterm_review/
1742061352.0,2025-03-15,The situation of the market,investing,JustDrop007,54,83,https://www.reddit.com/r/investing/comments/1jc0xk4/the_situation_of_the_market/
1741823182.0,2025-03-12,Remembering stock market crash of 2022,investing,kumaramit0703,2445,724,https://www.reddit.com/r/investing/comments/1j9ygro/remembering_stock_market_crash_of_2022/
1741805370.0,2025-03-12,CHGG: 20% downside / 200%+ upside?,investing,Alpha_Stratos,0,6,https://www.reddit.com/r/investing/comments/1j9rkno/chgg_20_downside_200_upside/
1741692932.0,2025-03-11,Post your portfolio and rate others,investing,Imaginary_Manager_44,0,18,https://www.reddit.com/r/investing/comments/1j8onh8/post_your_portfolio_and_rate_others/
1741682021.0,2025-03-11,Loading up on Tesla at this dip,investing,skybluebamboo,0,64,https://www.reddit.com/r/investing/comments/1j8m49r/loading_up_on_tesla_at_this_dip/
1741659158.0,2025-03-11,"2-fund, 0% TSLA, VOO replacement (aka, the F'ELON fund)",investing,bramblefuzz,0,20,https://www.reddit.com/r/investing/comments/1j8g78j/2fund_0_tsla_voo_replacement_aka_the_felon_fund/
1741634831.0,2025-03-10,Why the fuck does Waste Connection ($WCN) has a P/E of 84.06?,investing,TheCuriousBread,25,15,https://www.reddit.com/r/investing/comments/1j872ms/why_the_fuck_does_waste_connection_wcn_has_a_pe/
1741471111.0,2025-03-08,Will this pie will be enough for a decade?,investing,Yaadikillertje,0,57,https://www.reddit.com/r/investing/comments/1j6s4bs/will_this_pie_will_be_enough_for_a_decade/
1741447196.0,2025-03-08,"Are stock valuations simply a product of investor belief in scarcity? If we treat stocks as a store of value, like Bitcoin, gold, or even Tesla, does that make traditional macroeconomic analysis less relevant?",investing,ttforum,0,7,https://www.reddit.com/r/investing/comments/1j6jbvv/are_stock_valuations_simply_a_product_of_investor/
1741274434.0,2025-03-06,"Uh, I kinda shorted Tesla",investing,badharp,360,213,https://www.reddit.com/r/investing/comments/1j4xtgu/uh_i_kinda_shorted_tesla/
1741265352.0,2025-03-06,ETFs vs Pies - advantages + disadvantages,investing,Ghostjinn,7,6,https://www.reddit.com/r/investing/comments/1j4uphr/etfs_vs_pies_advantages_disadvantages/
1741197491.0,2025-03-05,How to remove certain company stocks from Vanguard retirement fund?,investing,rinlight,0,12,https://www.reddit.com/r/investing/comments/1j499p1/how_to_remove_certain_company_stocks_from/
1741186700.0,2025-03-05,"Holding SCHG, SCHX? Today you can make a statement.",investing,okwownice,0,60,https://www.reddit.com/r/investing/comments/1j44y1h/holding_schg_schx_today_you_can_make_a_statement/
1741182556.0,2025-03-05,What companies are doing something similar to Tesla?,investing,anobeg5,0,12,https://www.reddit.com/r/investing/comments/1j43h15/what_companies_are_doing_something_similar_to/
1741104523.0,2025-03-04,Morgan Stanley sees Tesla stock reaching $430,investing,thecount1989,0,17,https://www.reddit.com/r/investing/comments/1j3e8zr/morgan_stanley_sees_tesla_stock_reaching_430/
1741096197.0,2025-03-04,Tsla Stock thoughts and opinions,investing,Flocky_1,0,20,https://www.reddit.com/r/investing/comments/1j3b6he/tsla_stock_thoughts_and_opinions/
1740925044.0,2025-03-02,Which companies/funds will be hit hard in next major market downturn?,investing,drtywater,59,73,https://www.reddit.com/r/investing/comments/1j1rt79/which_companiesfunds_will_be_hit_hard_in_next/
1740882420.0,2025-03-02,Thoughts on investing in companies that don't align with your morals,investing,PabloEskimo_,0,182,https://www.reddit.com/r/investing/comments/1j1gfxe/thoughts_on_investing_in_companies_that_dont/
1740676592.0,2025-02-27,"Curious about TSLA and co-mingling with SpaceX, Twitter, and Starlink",investing,EqualWrite,0,1,https://www.reddit.com/r/investing/comments/1izkzc2/curious_about_tsla_and_comingling_with_spacex/
1740622154.0,2025-02-27,TSLA Update: Valuation BELOW $1T for the first time in 3 months. What’s going on?,investing,Yusuf-Uyghur,0,49,https://www.reddit.com/r/investing/comments/1iz4wcy/tsla_update_valuation_below_1t_for_the_first_time/
1740531547.0,2025-02-26,NVDA earnings expectations are way too high,investing,Successful_Tree_3172,180,130,https://www.reddit.com/r/investing/comments/1iyb55q/nvda_earnings_expectations_are_way_too_high/
1740491991.0,2025-02-25,The Bull Case for Xpeng ($XPEV),investing,iwannahaveyourbaby,6,1,https://www.reddit.com/r/investing/comments/1ixvmn7/the_bull_case_for_xpeng_xpev/
1740414387.0,2025-02-24,"How is Tesla, a car company with declining sales, trading at 160 P/E ratio?",investing,lineargangriseup,1234,224,https://www.reddit.com/r/investing/comments/1ix61td/how_is_tesla_a_car_company_with_declining_sales/
1740226165.0,2025-02-22,Extended Market Index Funds because current events?,investing,Representative-Rip90,1,21,https://www.reddit.com/r/investing/comments/1ivhckx/extended_market_index_funds_because_current_events/
1740011488.0,2025-02-20,Want to divest from several specific companies that are in index funds in my retirement account. How?,investing,Sans_vin,0,38,https://www.reddit.com/r/investing/comments/1itldxb/want_to_divest_from_several_specific_companies/
1739376179.0,2025-02-12,Is the Tesla Bubble about to pop?,investing,BirthdayOk5077,693,148,https://www.reddit.com/r/investing/comments/1inu9y7/is_the_tesla_bubble_about_to_pop/
1739104491.0,2025-02-09,"In your opinion, how would a Tesla market crash play out?",investing,patchyj,452,479,https://www.reddit.com/r/investing/comments/1ildrt1/in_your_opinion_how_would_a_tesla_market_crash/
1738960795.0,2025-02-07,Chinese Markets are Rejecting Tesla,investing,BirthdayOk5077,1788,314,https://www.reddit.com/r/investing/comments/1ik5337/chinese_markets_are_rejecting_tesla/
1738938705.0,2025-02-07,Hedge strategy for a tech heavy portfolio ?,investing,Individual_Type_7908,0,12,https://www.reddit.com/r/investing/comments/1ijwa8v/hedge_strategy_for_a_tech_heavy_portfolio/
1738859583.0,2025-02-06,Is Microsoft too powerful to be impacted by a Trade War?,investing,BirthdayOk5077,0,17,https://www.reddit.com/r/investing/comments/1ij6opc/is_microsoft_too_powerful_to_be_impacted_by_a/
1738752452.0,2025-02-05,There is either too much money in the system or people are learining how ti invest,investing,APC2_19,92,81,https://www.reddit.com/r/investing/comments/1ii7cew/there_is_either_too_much_money_in_the_system_or/
1738683872.0,2025-02-04,Tesla over valued should it be shorted?,investing,NaiveLandscape8744,253,263,https://www.reddit.com/r/investing/comments/1ihklb7/tesla_over_valued_should_it_be_shorted/
1738235549.0,2025-01-30,What would it take to remove Tesla from automatic pension investments,investing,Noseknowledge,0,7,https://www.reddit.com/r/investing/comments/1idkoka/what_would_it_take_to_remove_tesla_from_automatic/
1738202351.0,2025-01-30,Elon indicating battery production issues in earnings call today. Could possible acquisition be a solution for Tesla?,investing,FratWizard1911,0,6,https://www.reddit.com/r/investing/comments/1idb98p/elon_indicating_battery_production_issues_in/
1737991720.0,2025-01-27,Third Coast Bancshares: Continued Growth In A Booming Region,investing,Reasonable-Green-464,3,0,https://www.reddit.com/r/investing/comments/1ibbqer/third_coast_bancshares_continued_growth_in_a/
1737570274.0,2025-01-22,What makes you bullish on Tesla?,investing,Ok-Philosophy-7691,0,33,https://www.reddit.com/r/investing/comments/1i7hygg/what_makes_you_bullish_on_tesla/
1737131624.0,2025-01-17,Is there an etf full of only the biggest non tech companies without a lot of fat? ,investing,roberttootall,98,80,https://www.reddit.com/r/investing/comments/1i3kdeb/is_there_an_etf_full_of_only_the_biggest_non_tech/
1736670874.0,2025-01-12,Clients' returns and the stock company's profits are at odds with each other,investing,Andy_parker,24,17,https://www.reddit.com/r/investing/comments/1hzif6o/clients_returns_and_the_stock_companys_profits/
1736632222.0,2025-01-11,Are any of the Mag 7 Stocks a Buy right now?,investing,Specific_Leather_82,50,86,https://www.reddit.com/r/investing/comments/1hz6ul7/are_any_of_the_mag_7_stocks_a_buy_right_now/
1736587295.0,2025-01-11,"Stocks that doubled or more in 2 years (AMZN,GOOG,MSFT). If we have a correction how much will they likely pull back?",investing,StockRegard,0,30,https://www.reddit.com/r/investing/comments/1hysa3n/stocks_that_doubled_or_more_in_2_years/
1736267764.0,2025-01-07,The potential AI stocks in 2025,investing,chouchou1erim,2,2,https://www.reddit.com/r/investing/comments/1hvvgf2/the_potential_ai_stocks_in_2025/
1736218391.0,2025-01-07,Uber: A Great Buying Opportunity In Current Markets,investing,Goatofoptions,5,20,https://www.reddit.com/r/investing/comments/1hvhjnt/uber_a_great_buying_opportunity_in_current_markets/
1736204680.0,2025-01-06,This is why we dont buy Chinese stocks: US Dept of Defense Labels Tencent a military company ,investing,AnonymousTimewaster,1131,136,https://www.reddit.com/r/investing/comments/1hvcot5/this_is_why_we_dont_buy_chinese_stocks_us_dept_of/
1736186678.0,2025-01-06,Tesla's Deliveries Disappoint: Time To Take Profits (Rating Downgrade),investing,Goatofoptions,138,130,https://www.reddit.com/r/investing/comments/1hv5dc3/teslas_deliveries_disappoint_time_to_take_profits/
1736039941.0,2025-01-05,Getting that $1400 Covid stimulus and investing it for kids in AI,investing,RedParrot94,0,6,https://www.reddit.com/r/investing/comments/1httxor/getting_that_1400_covid_stimulus_and_investing_it/
1735892646.0,2025-01-03,$TSLA: How much of the growth in China can be attributed to state purchases?,investing,hmassive,0,3,https://www.reddit.com/r/investing/comments/1hshslu/tsla_how_much_of_the_growth_in_china_can_be/
1735788482.0,2025-01-02,Which stock do you regret selling too early since you start investing?,investing,Andy_parker,98,260,https://www.reddit.com/r/investing/comments/1hrki98/which_stock_do_you_regret_selling_too_early_since/
1735717003.0,2025-01-01,Bitcoin Isn’t Unique But Infinite—$100K Is Beyond Absurd,investing,Life_Ad_2756,0,61,https://www.reddit.com/r/investing/comments/1hqy8vw/bitcoin_isnt_unique_but_infinite100k_is_beyond/
1735644187.0,2024-12-31,Publicly listed Robotics companies?,investing,DatabaseMoist3246,7,6,https://www.reddit.com/r/investing/comments/1hqcs7j/publicly_listed_robotics_companies/
1735512432.0,2024-12-29,"Are any Mag 7 Stocks worth buying right now for long term, if not which are worth waiting for in 2025?",investing,Specific_Leather_82,96,160,https://www.reddit.com/r/investing/comments/1hp84q6/are_any_mag_7_stocks_worth_buying_right_now_for/
1734718716.0,2024-12-20,"Every Monday morning I invest $1,885. Here is how I divvy it up, can y'all provide feedback/opinions on my investing strategy please?",investing,22Cooper,1,58,https://www.reddit.com/r/investing/comments/1hiq21y/every_monday_morning_i_invest_1885_here_is_how_i/
1734716629.0,2024-12-20,Could GOEV (Canoo Inc.) Be a Hidden Gem and at a Place When Tesla Was at $1.33 Only or When Bitcoin was but Mere Cents Only?,investing,SevenDeMagnus,0,13,https://www.reddit.com/r/investing/comments/1hip93e/could_goev_canoo_inc_be_a_hidden_gem_and_at_a/
1734580283.0,2024-12-19,$TSLA how much growth of tesla justifies their P/E of 120?,investing,Sdogiscool,0,9,https://www.reddit.com/r/investing/comments/1hhk4yi/tsla_how_much_growth_of_tesla_justifies_their_pe/
1734518720.0,2024-12-18,"Getting started in investing, I have coin spot & stake (Australia)",investing,Jakfrost6,0,3,https://www.reddit.com/r/investing/comments/1hgz0da/getting_started_in_investing_i_have_coin_spot/
1734395057.0,2024-12-17,Ponzi Spotting: a laymen's guide to differentiating investments from Ponzi schemes,investing,TheKFChero,0,8,https://www.reddit.com/r/investing/comments/1hfy0q8/ponzi_spotting_a_laymens_guide_to_differentiating/
1734379359.0,2024-12-16,"Reminder: If You Trade More, Wall Street Makes More Money",investing,rik-huijzer,0,9,https://www.reddit.com/r/investing/comments/1hfs25j/reminder_if_you_trade_more_wall_street_makes_more/
1734377264.0,2024-12-16,Achieved my first milestone after 3 years!,investing,zerossoul,77,25,https://www.reddit.com/r/investing/comments/1hfr8dz/achieved_my_first_milestone_after_3_years/
1734373599.0,2024-12-16,Savings Diversity - General Questions,investing,Sure-Race-2650,3,0,https://www.reddit.com/r/investing/comments/1hfprfx/savings_diversity_general_questions/
1734358096.0,2024-12-16,2.5 year follow-up on buying the dip on pandemic stocks,investing,gabe736,840,184,https://www.reddit.com/r/investing/comments/1hfjvh8/25_year_followup_on_buying_the_dip_on_pandemic/
1734111967.0,2024-12-13,Stock Market:Opinion up or down?,investing,Dagobot78,0,5,https://www.reddit.com/r/investing/comments/1hdhscd/stock_marketopinion_up_or_down/
1734025863.0,2024-12-12,Returning to active stock portfolio management,investing,tried_it_didnt_work,5,4,https://www.reddit.com/r/investing/comments/1hcqtr1/returning_to_active_stock_portfolio_management/
1734015239.0,2024-12-12,Research is the key to your success ,investing,Optimal_Strain_8517,0,7,https://www.reddit.com/r/investing/comments/1hcmsel/research_is_the_key_to_your_success/
1733852718.0,2024-12-10,Unpopular opinion: I'm bullish on $GOOG,investing,LocoJorge7,0,21,https://www.reddit.com/r/investing/comments/1hb7hv5/unpopular_opinion_im_bullish_on_goog/
1733718738.0,2024-12-09,is my investment portfolio good for just turning 19?,investing,femboy_addi,0,41,https://www.reddit.com/r/investing/comments/1ha1q98/is_my_investment_portfolio_good_for_just_turning/
1733662070.0,2024-12-08,"I'm bullish on Rivian, and here is why.",investing,TheMensChef,54,111,https://www.reddit.com/r/investing/comments/1h9i57c/im_bullish_on_rivian_and_here_is_why/
1733047478.0,2024-12-01,A Second or Third Revisit of Why Warren Buffet May Not Have Fully Understood TSLA When He Said Value is Equivalent to the Whole Car Industry,investing,SevenDeMagnus,0,20,https://www.reddit.com/r/investing/comments/1h4063m/a_second_or_third_revisit_of_why_warren_buffet/
1733043241.0,2024-12-01,Thoughts on Tesla in December,investing,HappyBend9701,0,14,https://www.reddit.com/r/investing/comments/1h3z7qg/thoughts_on_tesla_in_december/
1732906580.0,2024-11-29,Thesis: A Food  for Though on Fundamentals of TSLA in Relationship to the Era When Warren Buffet Was Born,investing,SevenDeMagnus,0,3,https://www.reddit.com/r/investing/comments/1h2syee/thesis_a_food_for_though_on_fundamentals_of_tsla/
1732837477.0,2024-11-28,Talking with my dad about Nvidia over Thanksgiving,investing,HearAPianoFall,582,261,https://www.reddit.com/r/investing/comments/1h28t5b/talking_with_my_dad_about_nvidia_over_thanksgiving/
1732835565.0,2024-11-28,the TRUTH about investing no one tells you,investing,Woofrabbit,0,16,https://www.reddit.com/r/investing/comments/1h2886i/the_truth_about_investing_no_one_tells_you/
1732340516.0,2024-11-23,"In my late 20's, is there not value in investing in VT for 90% of my portfolio and then taking 10% of my portfolio and putting like 3.3% into stocks with potential to 10x or greater, like tesla, BTC, and ETH?",investing,the_evil_intp,0,16,https://www.reddit.com/r/investing/comments/1gxsmev/in_my_late_20s_is_there_not_value_in_investing_in/
1731864000.0,2024-11-17,I’ve got around $200k in an Inherited IRA (account must be closed and taxes paid within 10 years) Looking to put about half in a Trump-Friendly portfolio. Companies that will likely do very well under his administration. Is anybody doing the same?,investing,FinestDiamondNYC,0,35,https://www.reddit.com/r/investing/comments/1gtiief/ive_got_around_200k_in_an_inherited_ira_account/
1731708471.0,2024-11-15,Cash out on the horizon.....what should I do with modest earning?,investing,GhostfaceMillah,0,14,https://www.reddit.com/r/investing/comments/1gs84cu/cash_out_on_the_horizonwhat_should_i_do_with/
1731091916.0,2024-11-08,"Creating a Python library for Mandelbrot's metrics, doubts with Hurst Exponent/Scale",investing,packmad,6,0,https://www.reddit.com/r/investing/comments/1gmpzpr/creating_a_python_library_for_mandelbrots_metrics/
1731015652.0,2024-11-07,"What's the take on AAPL's future given Trump victory, Tariffs and Elon gaining more power",investing,tickerdesh,63,244,https://www.reddit.com/r/investing/comments/1gm1yta/whats_the_take_on_aapls_future_given_trump/
1730455784.0,2024-11-01,Need help regarding intrinsic value ,investing,mindhunter11010,0,9,https://www.reddit.com/r/investing/comments/1gh1z43/need_help_regarding_intrinsic_value/
1729978382.0,2024-10-26,The absolute madness of Tesla,investing,Zurkarak,0,18,https://www.reddit.com/r/investing/comments/1gcvh6t/the_absolute_madness_of_tesla/
1729906035.0,2024-10-26,College student savings allocation? ,investing,lankynotif,12,7,https://www.reddit.com/r/investing/comments/1gca1uz/college_student_savings_allocation/
1728504214.0,2024-10-09,What are some emerging sectors after AI?,investing,investpk,2,55,https://www.reddit.com/r/investing/comments/1g00p5j/what_are_some_emerging_sectors_after_ai/
1728341446.0,2024-10-07,Do you get the urge to gamble (with stocks) and how you deal with it. ,investing,terminator_911,90,112,https://www.reddit.com/r/investing/comments/1fyl2h9/do_you_get_the_urge_to_gamble_with_stocks_and_how/
1724648273.0,2024-08-26,Any tips on How to Safely Invest in U.S. Stocks from Asia? ,investing,whyeventrymore,11,3,https://www.reddit.com/r/investing/comments/1f1g575/any_tips_on_how_to_safely_invest_in_us_stocks/
1723430710.0,2024-08-12,Why did vanguard switch its vote to support the move to Texas and the $50 billion package for Musk?,investing,here_now_be,807,406,https://www.reddit.com/r/investing/comments/1eq2s2n/why_did_vanguard_switch_its_vote_to_support_the/
1722906837.0,2024-08-06,Taking investing seriously ,investing,Sure_Bodybuilder_494,2,15,https://www.reddit.com/r/investing/comments/1el4w60/taking_investing_seriously/
1722787318.0,2024-08-04,What are ways investors trying to actually guess the company performance.,investing,sin94,3,5,https://www.reddit.com/r/investing/comments/1ejynry/what_are_ways_investors_trying_to_actually_guess/
1722006976.0,2024-07-26,Selling at a loss/ planning for the future. ,investing,_vault_boy1,0,15,https://www.reddit.com/r/investing/comments/1ecqn5b/selling_at_a_loss_planning_for_the_future/
1721994551.0,2024-07-26,"Tesla stock downgraded to Sell, analysts say 'not much to like'",investing,cleare7,1669,434,https://www.reddit.com/r/investing/comments/1ecm3ra/tesla_stock_downgraded_to_sell_analysts_say_not/
