created_utc,date,title,subreddit,author,score,num_comments,url
1742908348.0,2025-03-25,"Tesla to hit $2,600 in the next 5 years, Cathie Wood tells Bloomberg",stocks,DzipaloJunuzHepek,0,55,https://www.reddit.com/r/stocks/comments/1jjj11s/tesla_to_hit_2600_in_the_next_5_years_cathie_wood/
1742822545.0,2025-03-24,"Volkswagen, BMW group electric cars outsell Tesla in Europe in February",stocks,callsonreddit,801,79,https://www.reddit.com/r/stocks/comments/1jiqjct/volkswagen_bmw_group_electric_cars_outsell_tesla/
1742822143.0,2025-03-24,These are the stocks on my watchlist (03/24) - Minor Market Bounce due to (some) held back tariffs,stocks,WinningWatchlist,39,14,https://www.reddit.com/r/stocks/comments/1jiqe9p/these_are_the_stocks_on_my_watchlist_0324_minor/
1742814163.0,2025-03-24,TSLA: Tesla to roll out full self-driving in China after software approval,stocks,Complete_Flower_8761,0,8,https://www.reddit.com/r/stocks/comments/1jinzxp/tsla_tesla_to_roll_out_full_selfdriving_in_china/
1742802557.0,2025-03-24,"Companies in the EU are starting to look for ways to ditch Amazon, Google, and Microsoft cloud services.",stocks,YourFuture2000,10138,642,https://www.reddit.com/r/stocks/comments/1jilfwg/companies_in_the_eu_are_starting_to_look_for_ways/
1742795572.0,2025-03-24,Tesla short thesis and the U.S. market (House of Cards) pending crash Part 2,stocks,Rainyfriedtofu,789,291,https://www.reddit.com/r/stocks/comments/1jijwnb/tesla_short_thesis_and_the_us_market_house_of/
1742763480.0,2025-03-23,Hey are you guys able to sell your Tesla stocks?,stocks,GloBear_shatti,0,31,https://www.reddit.com/r/stocks/comments/1ji9kqc/hey_are_you_guys_able_to_sell_your_tesla_stocks/
1742698302.0,2025-03-23,TSLA is the same as it was 6 months ago. Whats the big deal?,stocks,OpinionsRdumb,0,114,https://www.reddit.com/r/stocks/comments/1jhplu2/tsla_is_the_same_as_it_was_6_months_ago_whats_the/
1742665990.0,2025-03-22,Tesla short thesis and the U.S. market (House of Cards) pending crash,stocks,Rainyfriedtofu,930,367,https://www.reddit.com/r/stocks/comments/1jheaxd/tesla_short_thesis_and_the_us_market_house_of/
1742665687.0,2025-03-22,Tesla’s End-of-Lease Vehicle Accounting: How Falling Resale Values Impact Liabilities (2024-2025),stocks,th8aburn,246,40,https://www.reddit.com/r/stocks/comments/1jhe6r8/teslas_endoflease_vehicle_accounting_how_falling/
1742665356.0,2025-03-22,"How is everyone preparing Liberation Day, April 2?",stocks,Coolioissomething,591,836,https://www.reddit.com/r/stocks/comments/1jhe27y/how_is_everyone_preparing_liberation_day_april_2/
1742639097.0,2025-03-22,At which point does Tesla has to issue a profit warning?,stocks,vonnoor,1207,469,https://www.reddit.com/r/stocks/comments/1jh5g8g/at_which_point_does_tesla_has_to_issue_a_profit/
1742635552.0,2025-03-22,Is the TSLA Put trade the most crowded trade of 2025?,stocks,Chrissylumpy21,294,204,https://www.reddit.com/r/stocks/comments/1jh4nd5/is_the_tsla_put_trade_the_most_crowded_trade_of/
1742625603.0,2025-03-22,Rivian and Lucid,stocks,This_Possession8867,29,78,https://www.reddit.com/r/stocks/comments/1jh2gdq/rivian_and_lucid/
1742581258.0,2025-03-21,Will Tesla have a drop in yoy sales in their Q1 earnings?,stocks,BruhMansky,35,119,https://www.reddit.com/r/stocks/comments/1jgnnba/will_tesla_have_a_drop_in_yoy_sales_in_their_q1/
1742574761.0,2025-03-21,Top Tesla Investor Demands Musk's Exit Amid Stock Plunge,stocks,GooseberryGOLD,3817,195,https://www.reddit.com/r/stocks/comments/1jgl0wc/top_tesla_investor_demands_musks_exit_amid_stock/
1742571625.0,2025-03-21,Meet the Former Tesla Die-Hards Now Selling Their Shares,stocks,parityposse,273,35,https://www.reddit.com/r/stocks/comments/1jgjrpp/meet_the_former_tesla_diehards_now_selling_their/
1742569948.0,2025-03-21,Tesla’s Retail Fans Buy the Stock at a Pace Never Seen Before,stocks,cefpodoxime,957,504,https://www.reddit.com/r/stocks/comments/1jgj4af/teslas_retail_fans_buy_the_stock_at_a_pace_never/
1742518455.0,2025-03-21,Short sellers have made $15 billion betting against Tesla and Nvidia in 2025,stocks,callsonreddit,566,33,https://www.reddit.com/r/stocks/comments/1jg4qgf/short_sellers_have_made_15_billion_betting/
1742518265.0,2025-03-21,Exclusive-Tesla trade-ins on pace for record high amid Musk backlash,stocks,callsonreddit,771,79,https://www.reddit.com/r/stocks/comments/1jg4o6x/exclusivetesla_tradeins_on_pace_for_record_high/
1742498857.0,2025-03-20,$UBER: Self Driving King Maker,stocks,snem420,0,30,https://www.reddit.com/r/stocks/comments/1jfx9en/uber_self_driving_king_maker/
1742498704.0,2025-03-20,Regulators recall nearly all Cybertrucks due to panel consistently falling off,stocks,Hiversitize,2690,216,https://www.reddit.com/r/stocks/comments/1jfx762/regulators_recall_nearly_all_cybertrucks_due_to/
1742494797.0,2025-03-20,Commerce secretary begs Fox News viewers to buy Tesla stock in bizarre interview,stocks,SPXQuantAlgo,6422,785,https://www.reddit.com/r/stocks/comments/1jfvmd0/commerce_secretary_begs_fox_news_viewers_to_buy/
1742484597.0,2025-03-20,Tesla Fair Value,stocks,onepanto,0,81,https://www.reddit.com/r/stocks/comments/1jfrju1/tesla_fair_value/
1742482901.0,2025-03-20,"Wedbush analyst Dan Ives sharpened his criticism of how Elon Musk is running Tesla Inc., saying the electric-vehicle giant’s chief executive",stocks,Ok-Economist-5975,221,60,https://www.reddit.com/r/stocks/comments/1jfqwwx/wedbush_analyst_dan_ives_sharpened_his_criticism/
1742476430.0,2025-03-20,These are the stocks on my watchlist (03/20) - TSLA is (very likely) NOT a fraud company,stocks,WinningWatchlist,0,7,https://www.reddit.com/r/stocks/comments/1jfom20/these_are_the_stocks_on_my_watchlist_0320_tsla_is/
1742471598.0,2025-03-20,Tesla (TSLA) accounting raises red flags as report shows $1.4 billion missing,stocks,SPXQuantAlgo,14675,668,https://www.reddit.com/r/stocks/comments/1jfn3wn/tesla_tsla_accounting_raises_red_flags_as_report/
1742450932.0,2025-03-20,A Deeper Dive on Trump's Tariffs and Market Positioning,stocks,notllmchatbot,0,10,https://www.reddit.com/r/stocks/comments/1jfidz3/a_deeper_dive_on_trumps_tariffs_and_market/
1742432626.0,2025-03-20,"Cantor Fitzgerald Upgrades Tesla to Overweight From Neutral, Price Target is $425",stocks,LKM_44122,2171,283,https://www.reddit.com/r/stocks/comments/1jfd2qo/cantor_fitzgerald_upgrades_tesla_to_overweight/
1742426349.0,2025-03-19,Will tesla ever recover?,stocks,Advanced_Emu3430,0,49,https://www.reddit.com/r/stocks/comments/1jfavnz/will_tesla_ever_recover/
1742418155.0,2025-03-19,How Objective Are Tesla Analysts? Rating Upgrade Today.,stocks,iD-10T_usererror,190,79,https://www.reddit.com/r/stocks/comments/1jf7qj6/how_objective_are_tesla_analysts_rating_upgrade/
1742413659.0,2025-03-19,The Fate of the S&P's 10 Most Popular Stocks,stocks,paypropda,0,5,https://www.reddit.com/r/stocks/comments/1jf5wx4/the_fate_of_the_sps_10_most_popular_stocks/
1742406501.0,2025-03-19,Where Will Tesla Be in 2030?Stock Market Analysis,stocks,MrPixeldot,0,28,https://www.reddit.com/r/stocks/comments/1jf301z/where_will_tesla_be_in_2030stock_market_analysis/
1742401434.0,2025-03-19,Is Rivian a good buy now?,stocks,peatoast,0,85,https://www.reddit.com/r/stocks/comments/1jf0ym9/is_rivian_a_good_buy_now/
1742399973.0,2025-03-19,Tesla without Musk,stocks,onepanto,0,49,https://www.reddit.com/r/stocks/comments/1jf0dif/tesla_without_musk/
1742389988.0,2025-03-19,These are the stocks on my watchlist (03/19) - INTC/TSM Rumors Debunked!,stocks,WinningWatchlist,42,10,https://www.reddit.com/r/stocks/comments/1jewnms/these_are_the_stocks_on_my_watchlist_0319_intctsm/
1742378416.0,2025-03-19,Tesla gets first in a series of permits it needs to run robotaxis in California,stocks,Complete_Flower_8761,0,5,https://www.reddit.com/r/stocks/comments/1jetgkm/tesla_gets_first_in_a_series_of_permits_it_needs/
1742343167.0,2025-03-19,Why Tesla deserves a look and probably a Buy at these Levels,stocks,rifleman209,0,104,https://www.reddit.com/r/stocks/comments/1jek6fx/why_tesla_deserves_a_look_and_probably_a_buy_at/
1742325860.0,2025-03-18,NVDA: Groot N1 our foundation model for humanoid robots will be open source,stocks,r2002,51,2,https://www.reddit.com/r/stocks/comments/1jedfpt/nvda_groot_n1_our_foundation_model_for_humanoid/
1742320050.0,2025-03-18,"Tesla board members, executive sell off over $100 million of stock in recent weeks",stocks,Puginator,1754,205,https://www.reddit.com/r/stocks/comments/1jeb0sq/tesla_board_members_executive_sell_off_over_100/
1742307580.0,2025-03-18,Short sellers make $16bn profit from Tesla’s share price plunge,stocks,Alex09464367,4375,405,https://www.reddit.com/r/stocks/comments/1je61z1/short_sellers_make_16bn_profit_from_teslas_share/
1742303578.0,2025-03-18,These are the stocks on my watchlist (03/18) - TSLA Troubles,stocks,WinningWatchlist,4,31,https://www.reddit.com/r/stocks/comments/1je4mi4/these_are_the_stocks_on_my_watchlist_0318_tsla/
1742239929.0,2025-03-17,Best EV automaker stock to invest in as an alternative to $TSLA?,stocks,RealLychee3700,0,134,https://www.reddit.com/r/stocks/comments/1jdlhmv/best_ev_automaker_stock_to_invest_in_as_an/
1742219975.0,2025-03-17,Is polestar going to pick up Tesla customers,stocks,Unable_Radish_2925,130,154,https://www.reddit.com/r/stocks/comments/1jddajm/is_polestar_going_to_pick_up_tesla_customers/
1742067324.0,2025-03-15,Tesla stock declines could cost Elon Musk something important,stocks,AndroidOne1,1934,429,https://www.reddit.com/r/stocks/comments/1jc36c5/tesla_stock_declines_could_cost_elon_musk/
1741997824.0,2025-03-15,Tesla done in Germany.  94% say they won’t buy a Tesla car.,stocks,EbolaaPancakes,13531,661,https://www.reddit.com/r/stocks/comments/1jbijyg/tesla_done_in_germany_94_say_they_wont_buy_a/
1741981423.0,2025-03-14,S&P 500 Stages Rebound After $5 Trillion Plunge: Markets Wrap,stocks,WinningWatchlist,173,128,https://www.reddit.com/r/stocks/comments/1jbcflu/sp_500_stages_rebound_after_5_trillion_plunge/
1741978934.0,2025-03-14,Tesla warns of retaliatory tariffs. BofA thinks Trump will flip on trade policy,stocks,r2002,860,207,https://www.reddit.com/r/stocks/comments/1jbbfux/tesla_warns_of_retaliatory_tariffs_bofa_thinks/
1741967942.0,2025-03-14,"Elon Musk is winning Republican fans. Can Tesla win them over, too?",stocks,joe4942,0,34,https://www.reddit.com/r/stocks/comments/1jb7ack/elon_musk_is_winning_republican_fans_can_tesla/
1741964345.0,2025-03-14,"Multiple TSLAs set on fire in Germany, and driven into rivers in Canada. Will this increase insurance premiums of TSLAs, and impact sales?",stocks,Mountain-Taro-123,3850,287,https://www.reddit.com/r/stocks/comments/1jb5vp9/multiple_tslas_set_on_fire_in_germany_and_driven/
1741874153.0,2025-03-13,Tesla (TSLA) Stock: Trump’s Purchase Fails to Sustain Rally,stocks,1slinkydink1,4260,496,https://www.reddit.com/r/stocks/comments/1jaciwt/tesla_tsla_stock_trumps_purchase_fails_to_sustain/
1741858016.0,2025-03-13,What are you guys buying?,stocks,Bencsisten,127,512,https://www.reddit.com/r/stocks/comments/1ja80i2/what_are_you_guys_buying/
1741828088.0,2025-03-13,Is Teslas best chance of survival the removal of Elon Musk?,stocks,aTurnedOnCow,511,556,https://www.reddit.com/r/stocks/comments/1ja07k6/is_teslas_best_chance_of_survival_the_removal_of/
1741816620.0,2025-03-12,Why do people buy high P/E companies over low ones?,stocks,rhapsodyforever,0,55,https://www.reddit.com/r/stocks/comments/1j9vzu8/why_do_people_buy_high_pe_companies_over_low_ones/
1741803951.0,2025-03-12,"TSLA investors, beware",stocks,New-Ad-9629,7233,1252,https://www.reddit.com/r/stocks/comments/1j9qzgg/tsla_investors_beware/
1741793181.0,2025-03-12,Tesla investor survey shows 85% believe Elon Musk’s politics are having ‘negative’ or ‘extremely negative’ impact on company,stocks,Puginator,5634,186,https://www.reddit.com/r/stocks/comments/1j9mlkx/tesla_investor_survey_shows_85_believe_elon_musks/
1741725622.0,2025-03-11,Tesla and other stock prices are up,stocks,piperacilline,0,43,https://www.reddit.com/r/stocks/comments/1j910vx/tesla_and_other_stock_prices_are_up/
1741711292.0,2025-03-11,Waymo expands robotaxi service in Silicon Valley,stocks,Puginator,26,15,https://www.reddit.com/r/stocks/comments/1j8v68z/waymo_expands_robotaxi_service_in_silicon_valley/
1741707290.0,2025-03-11,Is TSLA permanently toast?,stocks,37inFinals,13320,2813,https://www.reddit.com/r/stocks/comments/1j8tkdx/is_tsla_permanently_toast/
1741700775.0,2025-03-11,Thoughts about TSLZ?,stocks,silverminer49er,13,51,https://www.reddit.com/r/stocks/comments/1j8r47h/thoughts_about_tslz/
1741699031.0,2025-03-11,These are the stocks on my watchlist (03/11),stocks,WinningWatchlist,0,4,https://www.reddit.com/r/stocks/comments/1j8qi84/these_are_the_stocks_on_my_watchlist_0311/
1741685254.0,2025-03-11,I want to understand how the US stock market works,stocks,AppleDJ,5,23,https://www.reddit.com/r/stocks/comments/1j8msy7/i_want_to_understand_how_the_us_stock_market_works/
1741669511.0,2025-03-11,Trump Says He’ll Buy a Tesla to Support Musk After Shares Plunge,stocks,joe4942,4411,1116,https://www.reddit.com/r/stocks/comments/1j8jamd/trump_says_hell_buy_a_tesla_to_support_musk_after/
1741656926.0,2025-03-11,Tech megacaps lose over $750 billion in market cap in worst day for Nasdaq since 2022,stocks,Puginator,391,38,https://www.reddit.com/r/stocks/comments/1j8fg5d/tech_megacaps_lose_over_750_billion_in_market_cap/
1741653413.0,2025-03-11,Tesla still a long ways to fall,stocks,DeathStar_81,805,183,https://www.reddit.com/r/stocks/comments/1j8e8xo/tesla_still_a_long_ways_to_fall/
1741645564.0,2025-03-10,"Tesla shares plunge 15%, suffering steepest drop in five years",stocks,Puginator,1964,245,https://www.reddit.com/r/stocks/comments/1j8bbhl/tesla_shares_plunge_15_suffering_steepest_drop_in/
1741643747.0,2025-03-10,Finally some realisable research around why TSLA is down,stocks,Senior_Tadpole_3913,0,10,https://www.reddit.com/r/stocks/comments/1j8ambc/finally_some_realisable_research_around_why_tsla/
1741638734.0,2025-03-10,All announced company changes for MAG7 and stock price movements for today:,stocks,thelastsubject123,0,21,https://www.reddit.com/r/stocks/comments/1j88lrt/all_announced_company_changes_for_mag7_and_stock/
1741622504.0,2025-03-10,Tesla as an indicator,stocks,tales6888,285,119,https://www.reddit.com/r/stocks/comments/1j821ug/tesla_as_an_indicator/
1741563358.0,2025-03-09,TSLA being investigated by Transport Canada for cooking their books in Canada to snag EV rebates without selling cars.,stocks,Mountain-Taro-123,18877,494,https://www.reddit.com/r/stocks/comments/1j7l0bv/tsla_being_investigated_by_transport_canada_for/
1741378871.0,2025-03-07,Suspicious Tesla Sales Surge Triggers Canadian Government Investigation,stocks,esporx,7474,316,https://www.reddit.com/r/stocks/comments/1j5z8gn/suspicious_tesla_sales_surge_triggers_canadian/
1741367017.0,2025-03-07,When will Tesla consider a new CEO due to stock drop?,stocks,Spinach_Proper,798,552,https://www.reddit.com/r/stocks/comments/1j5tn1m/when_will_tesla_consider_a_new_ceo_due_to_stock/
1741319642.0,2025-03-07,What are you guys shorting tomorrow?,stocks,BeefistPrime,0,98,https://www.reddit.com/r/stocks/comments/1j5enzs/what_are_you_guys_shorting_tomorrow/
1741280807.0,2025-03-06,Tesla going under 100 in year or 2 thesis,stocks,Ordinary_Topic_6374,455,268,https://www.reddit.com/r/stocks/comments/1j50cfd/tesla_going_under_100_in_year_or_2_thesis/
1741278212.0,2025-03-06,Is it normal to be blocked from trading inverse ETFs?,stocks,Tsuketsu,15,9,https://www.reddit.com/r/stocks/comments/1j4zact/is_it_normal_to_be_blocked_from_trading_inverse/
1741183822.0,2025-03-05,These are the stocks on my watchlist (03/5) - Trump's Speech Dissect,stocks,WinningWatchlist,8,18,https://www.reddit.com/r/stocks/comments/1j43x5l/these_are_the_stocks_on_my_watchlist_035_trumps/
1741182160.0,2025-03-05,Tesla car registrations in Germany down 76% in February compared to 2024,stocks,Maxizzles,945,63,https://www.reddit.com/r/stocks/comments/1j43cd7/tesla_car_registrations_in_germany_down_76_in/
1741114387.0,2025-03-04,Elon Musk tries and fails to pump Tesla’s stock (TSLA),stocks,Negative-River-2865,3544,476,https://www.reddit.com/r/stocks/comments/1j3ibxk/elon_musk_tries_and_fails_to_pump_teslas_stock/
1741100012.0,2025-03-04,"Tesla Chair Robyn Denholm Sells Over $30 Million Worth Of Stock As Automaker Grapples With Macroeconomic Uncertainties, Increased Competion",stocks,Negative-River-2865,368,52,https://www.reddit.com/r/stocks/comments/1j3civx/tesla_chair_robyn_denholm_sells_over_30_million/
1741097967.0,2025-03-04,These are the stocks on my watchlist (03/4) - Tariff Edition!,stocks,WinningWatchlist,0,1,https://www.reddit.com/r/stocks/comments/1j3bswe/these_are_the_stocks_on_my_watchlist_034_tariff/
1741090206.0,2025-03-04,Waymo & Uber start offering rides In Austin from today,stocks,Mikeymoo,19,8,https://www.reddit.com/r/stocks/comments/1j39ch4/waymo_uber_start_offering_rides_in_austin_from/
1741044587.0,2025-03-03,Tesla for Sale: Buyer’s Remorse Sinks In for Elon Musk’s E.V.-Owning Critics,stocks,joe4942,790,272,https://www.reddit.com/r/stocks/comments/1j2wrf7/tesla_for_sale_buyers_remorse_sinks_in_for_elon/
1741013870.0,2025-03-03,"Tesla sales plunges 70% in Norway, what might the future bring",stocks,Negative-River-2865,3141,285,https://www.reddit.com/r/stocks/comments/1j2khkm/tesla_sales_plunges_70_in_norway_what_might_the/
1740888171.0,2025-03-02,Anti-DOGE protests at Tesla stores target Elon Musk’s bottom line,stocks,joe4942,1286,327,https://www.reddit.com/r/stocks/comments/1j1i6hk/antidoge_protests_at_tesla_stores_target_elon/
1740863749.0,2025-03-01,Serious question: why do people think Tesla will survive?,stocks,mightyeelstrength,1166,1230,https://www.reddit.com/r/stocks/comments/1j19zlc/serious_question_why_do_people_think_tesla_will/
1740725804.0,2025-02-28,Tesla’s 40% Plunge Burns Koreans Who Plowed Into Leveraged ETFs,stocks,joe4942,1406,129,https://www.reddit.com/r/stocks/comments/1j01tp4/teslas_40_plunge_burns_koreans_who_plowed_into/
1740719978.0,2025-02-28,"Tesla, does anyone believe in the viability of the company?",stocks,GVT84,0,21,https://www.reddit.com/r/stocks/comments/1j00c6v/tesla_does_anyone_believe_in_the_viability_of_the/
1740685765.0,2025-02-27,Some DD on European Defense Companies,stocks,AnonymousTimewaster,125,39,https://www.reddit.com/r/stocks/comments/1izooi2/some_dd_on_european_defense_companies/
1740683060.0,2025-02-27,"Tesla seeking approval to offer ride-hailing services in California, Bloomberg News reports",stocks,Puginator,3,47,https://www.reddit.com/r/stocks/comments/1iznm3n/tesla_seeking_approval_to_offer_ridehailing/
1740669235.0,2025-02-27,Reddit picks winners!,stocks,DoU92,0,29,https://www.reddit.com/r/stocks/comments/1izi0k0/reddit_picks_winners/
1740662565.0,2025-02-27,Nvidia’s auto segment revenue surges to record high on demand for driver-assist tech,stocks,Puginator,105,10,https://www.reddit.com/r/stocks/comments/1izfnba/nvidias_auto_segment_revenue_surges_to_record/
1740651797.0,2025-02-27,Is Tesla going down and staying there?,stocks,person_person123,535,701,https://www.reddit.com/r/stocks/comments/1izcnxf/is_tesla_going_down_and_staying_there/
1740650454.0,2025-02-27,What's the bull case for Apple to outperform other MAG7 (-tesla) stocks?,stocks,DataFinanceGamer,5,43,https://www.reddit.com/r/stocks/comments/1izcck9/whats_the_bull_case_for_apple_to_outperform_other/
1740579262.0,2025-02-26,These are the stocks on my watchlist (02/26),stocks,WinningWatchlist,36,9,https://www.reddit.com/r/stocks/comments/1iyogaj/these_are_the_stocks_on_my_watchlist_0226/
1740562835.0,2025-02-26,Why I Went All-In on Tesla and maybe you should too – The Future is Here,stocks,Dvass138,0,32,https://www.reddit.com/r/stocks/comments/1iyjv2c/why_i_went_allin_on_tesla_and_maybe_you_should/
1740536095.0,2025-02-26,Tesla’s market cap sinks below $1 trillion as stock slumps more than 8%,stocks,Puginator,2185,233,https://www.reddit.com/r/stocks/comments/1iycoxa/teslas_market_cap_sinks_below_1_trillion_as_stock/
1740517115.0,2025-02-25,Tesla sales in Europe down 45% in January,stocks,DaddyVaradkar,2055,180,https://www.reddit.com/r/stocks/comments/1iy5new/tesla_sales_in_europe_down_45_in_january/
1740412376.0,2025-02-24,One word Data,stocks,Dvass138,35,18,https://www.reddit.com/r/stocks/comments/1ix58gk/one_word_data/
1740089532.0,2025-02-20,BYD and its rivals are crushing Tesla in China — and they're going global,stocks,mr_fobolous,1268,329,https://www.reddit.com/r/stocks/comments/1iuayic/byd_and_its_rivals_are_crushing_tesla_in_china/
1740017137.0,2025-02-20,"Palantir plunges after CEO Karp changes share sales plan, Pentagon budget cut report",stocks,Puginator,915,117,https://www.reddit.com/r/stocks/comments/1itncot/palantir_plunges_after_ceo_karp_changes_share/
1739978256.0,2025-02-19,Auto stocks today,stocks,unbannable5,20,19,https://www.reddit.com/r/stocks/comments/1it7urf/auto_stocks_today/
1739715765.0,2025-02-16,What companies are you bearish about over the next 1-2 years?,stocks,Agreeable_Beat5348,376,870,https://www.reddit.com/r/stocks/comments/1iqt7vb/what_companies_are_you_bearish_about_over_the/
1739696431.0,2025-02-16,Which stocks have the best leadership?,stocks,Cow_Fam,91,142,https://www.reddit.com/r/stocks/comments/1iqo9os/which_stocks_have_the_best_leadership/
1739633423.0,2025-02-15,How Musk is using TSLA as a piggy bank,stocks,Counterakt,1039,344,https://www.reddit.com/r/stocks/comments/1iq3s4q/how_musk_is_using_tsla_as_a_piggy_bank/
1739551461.0,2025-02-14,Meta plans major investment into AI-powered humanoid robots,stocks,_hiddenscout,118,86,https://www.reddit.com/r/stocks/comments/1ipetzp/meta_plans_major_investment_into_aipowered/
1739465457.0,2025-02-13,Anyone take a margin loan for a mortgage down payment recently?,stocks,Famousdeadrummer,3,26,https://www.reddit.com/r/stocks/comments/1ioniee/anyone_take_a_margin_loan_for_a_mortgage_down/
1739454143.0,2025-02-13,Apple’s Stock-Market Performance Is Increasingly Made in China,stocks,WinningWatchlist,67,20,https://www.reddit.com/r/stocks/comments/1iojaoh/apples_stockmarket_performance_is_increasingly/
1739425828.0,2025-02-13,Investing in Hyundai?,stocks,Tiger_bomb_241,16,24,https://www.reddit.com/r/stocks/comments/1iocdye/investing_in_hyundai/
1739386053.0,2025-02-12,Tesla stock is tumbling. Blame BYD,stocks,mr_fobolous,2759,490,https://www.reddit.com/r/stocks/comments/1inydfk/tesla_stock_is_tumbling_blame_byd/
1739377864.0,2025-02-12,Why is Tesla Share Price so Expensive?,stocks,DipeshDaga,0,20,https://www.reddit.com/r/stocks/comments/1inuyqj/why_is_tesla_share_price_so_expensive/
1739312413.0,2025-02-11,TSLA isn't the NVIDIA of EV's anymore,stocks,rairiig,3348,603,https://www.reddit.com/r/stocks/comments/1inb7p0/tsla_isnt_the_nvidia_of_evs_anymore/
1739293842.0,2025-02-11,Full bearish on TSLA???,stocks,thecrocofwallstreet,3,74,https://www.reddit.com/r/stocks/comments/1in3m01/full_bearish_on_tsla/
1739226792.0,2025-02-10,Tesla stock will crash in the upcoming months,stocks,iliketoeatwood,1,56,https://www.reddit.com/r/stocks/comments/1imj7ed/tesla_stock_will_crash_in_the_upcoming_months/
1739206270.0,2025-02-10,Why is Tesla stocks not collapsing? (Genuine question),stocks,Intelligent_Finger88,2369,1390,https://www.reddit.com/r/stocks/comments/1imaowd/why_is_tesla_stocks_not_collapsing_genuine/
1739109012.0,2025-02-09,I want to invest in $UBER - help,stocks,vincentsigmafreeman,65,90,https://www.reddit.com/r/stocks/comments/1ilf3sk/i_want_to_invest_in_uber_help/
1739005035.0,2025-02-08,How do I reduce exposure to certain stocks from S&P 500?,stocks,mitigatedcactussquat,0,48,https://www.reddit.com/r/stocks/comments/1ikj5m5/how_do_i_reduce_exposure_to_certain_stocks_from/
1738959679.0,2025-02-07,Chinese Markets are Rejecting Tesla,stocks,BirthdayOk5077,3341,367,https://www.reddit.com/r/stocks/comments/1ik4nfq/chinese_markets_are_rejecting_tesla/
1738948558.0,2025-02-07,Tesla car sales in China fall 11.5% as competition intensifies,stocks,Puginator,1059,118,https://www.reddit.com/r/stocks/comments/1ik062b/tesla_car_sales_in_china_fall_115_as_competition/
1738863398.0,2025-02-06,Tesla gears up for Optimus production with hiring push at Fremont factory,stocks,Puginator,0,35,https://www.reddit.com/r/stocks/comments/1ij89u7/tesla_gears_up_for_optimus_production_with_hiring/
1738829897.0,2025-02-06,Is Microsoft too big to be affected by a Trade War?,stocks,MaesterHannibal,148,162,https://www.reddit.com/r/stocks/comments/1iixryb/is_microsoft_too_big_to_be_affected_by_a_trade_war/
1738638592.0,2025-02-04,Tesla’s Valuation: Speculation or Real Growth? My DCF Insights,stocks,TheiaFintech,12,85,https://www.reddit.com/r/stocks/comments/1ih835v/teslas_valuation_speculation_or_real_growth_my/
1738464090.0,2025-02-02,Canada will retaliate with 25% tariffs on US imports and limit export of rare minerals as response to Trump tariffs! Trade war is on!,stocks,ThinkBigger01,18604,1143,https://www.reddit.com/r/stocks/comments/1ifna8h/canada_will_retaliate_with_25_tariffs_on_us/
1738350711.0,2025-01-31,"PSA: Tesla's Market Cap is now higher than the top 10 non Chinese car companies, the top solar companies, and Uber all combined",stocks,draculabakula,863,286,https://www.reddit.com/r/stocks/comments/1iemmrp/psa_teslas_market_cap_is_now_higher_than_the_top/
1746689319.0,2025-05-08,"Google is at a 40 pe ratio, excluding the search revenue",investing,realmemessk,755,209,https://www.reddit.com/r/investing/comments/1khk8sf/google_is_at_a_40_pe_ratio_excluding_the_search/
1746385960.0,2025-05-04,"What has Elon Musk and Jeff Besos done that made them so rich? The CEOs and founders of Apple, Microsoft and Google are worth less despite those companies have a higher revenue on the Forbs list.",investing,Big_Flan_4492,543,279,https://www.reddit.com/r/investing/comments/1kers0h/what_has_elon_musk_and_jeff_besos_done_that_made/
