created_utc,date,title,subreddit,author,score,num_comments,url
1746800483.0,2025-05-09,Why is tesla stocks rising so fast?,stocks,TheGodfather7100,750,798,https://www.reddit.com/r/stocks/comments/1kijott/why_is_tesla_stocks_rising_so_fast/
1746795255.0,2025-05-09,Cathie Wood on CNBC this morning,stocks,Trey123RE,0,72,https://www.reddit.com/r/stocks/comments/1kihror/cathie_wood_on_cnbc_this_morning/
1746747247.0,2025-05-08,Thoughts on $HIMS,stocks,carpetmagicianlaughs,0,10,https://www.reddit.com/r/stocks/comments/1ki4jb5/thoughts_on_hims/
1746737707.0,2025-05-08,Tesla’s ‘Robotaxi’ and ‘Cybercab’ trademarks hit roadblocks ahead of June launch,stocks,joe4942,178,38,https://www.reddit.com/r/stocks/comments/1ki0zjl/teslas_robotaxi_and_cybercab_trademarks_hit/
1746736255.0,2025-05-08,Palantir now among 10 most valuable U.S. tech companies — its earnings multiple is astronomical,stocks,Puginator,479,172,https://www.reddit.com/r/stocks/comments/1ki0es0/palantir_now_among_10_most_valuable_us_tech/
1746722156.0,2025-05-08,Swede here I'm short Tesla,stocks,OrkzOrkzOrkzOrkz0rkz,65,135,https://www.reddit.com/r/stocks/comments/1khulan/swede_here_im_short_tesla/
1746708415.0,2025-05-08,Rivian stock,stocks,Z8beema,29,32,https://www.reddit.com/r/stocks/comments/1khp8d9/rivian_stock/
1746545975.0,2025-05-06,"LCID - with elon driving TSLA into firepits, is LCID likely going to benefit ? Upcoming ER move ?",stocks,goodpointbadpoint,14,64,https://www.reddit.com/r/stocks/comments/1kg7n03/lcid_with_elon_driving_tsla_into_firepits_is_lcid/
1746462676.0,2025-05-05,Best (non-tesla) stock to short in the face of a recession,stocks,sunburn74,0,37,https://www.reddit.com/r/stocks/comments/1kfg17l/best_nontesla_stock_to_short_in_the_face_of_a/
1746452913.0,2025-05-05,"Tariffs Threaten Semiconductor Supply Chains, Chip-Equipment Maker Warns",stocks,Fidler_2K,60,12,https://www.reddit.com/r/stocks/comments/1kfc2gu/tariffs_threaten_semiconductor_supply_chains/
1746446649.0,2025-05-05,"Most people strategy in the market is broken, and think the market is broken",stocks,Wiser-dude,0,11,https://www.reddit.com/r/stocks/comments/1kf9wrn/most_people_strategy_in_the_market_is_broken_and/
1746222774.0,2025-05-02,China’s EV Revolution Left US Automakers Behind — Trump Just Sped It Up,stocks,azavio,372,86,https://www.reddit.com/r/stocks/comments/1kdcx9b/chinas_ev_revolution_left_us_automakers_behind/
1746205753.0,2025-05-02,Short Seller Jim Chanos Rips On Tesla's Robotaxi,stocks,iD-10T_usererror,142,92,https://www.reddit.com/r/stocks/comments/1kd68s8/short_seller_jim_chanos_rips_on_teslas_robotaxi/
1746180797.0,2025-05-02,Microsoft breaking its back carrying the S&P,stocks,ShogunMyrnn,58,52,https://www.reddit.com/r/stocks/comments/1kcxdu8/microsoft_breaking_its_back_carrying_the_sp/
1746124207.0,2025-05-01,"Electric vehicles, solar panels, and humanoid worker robots...and the WINNER IS...",stocks,CrazyAspie88,0,19,https://www.reddit.com/r/stocks/comments/1kcfyh4/electric_vehicles_solar_panels_and_humanoid/
1746112512.0,2025-05-01,The stock market is fully gaslit for this reason,stocks,bubblewrapture,3147,592,https://www.reddit.com/r/stocks/comments/1kcb7tr/the_stock_market_is_fully_gaslit_for_this_reason/
1746111357.0,2025-05-01,Will Tesla as a brand recover from Elons involvement in US politics?,stocks,ProfessionalFirst280,0,32,https://www.reddit.com/r/stocks/comments/1kcaqm3/will_tesla_as_a_brand_recover_from_elons/
1746109553.0,2025-05-01,Nasdaq Plan Will Bring Zero-Day Option Boom Closer to Single Stocks,stocks,joe4942,5,1,https://www.reddit.com/r/stocks/comments/1kca1fo/nasdaq_plan_will_bring_zeroday_option_boom_closer/
1746104937.0,2025-05-01,(05/1) Interesting Stocks Today - Unemployment gets Worse,stocks,WinningWatchlist,14,23,https://www.reddit.com/r/stocks/comments/1kc8biy/051_interesting_stocks_today_unemployment_gets/
1746061941.0,2025-05-01,Tesla Board Opened Search for a CEO to Succeed Elon Musk,stocks,salientlife93,949,133,https://www.reddit.com/r/stocks/comments/1kbwovj/tesla_board_opened_search_for_a_ceo_to_succeed/
1745938877.0,2025-04-29,Trump's Tariff On/Off Switch: On Autos & Tesla's Advantage,stocks,iD-10T_usererror,32,12,https://www.reddit.com/r/stocks/comments/1kaq2fk/trumps_tariff_onoff_switch_on_autos_teslas/
1745900306.0,2025-04-29,Cisco’s Dot Com Collapse and Dead Cat Bounce—— A Cautionary Tale,stocks,kmmeow1,86,33,https://www.reddit.com/r/stocks/comments/1kafc4d/ciscos_dot_com_collapse_and_dead_cat_bounce_a/
1745886801.0,2025-04-29,"Trump First 100 days ending April 29, 2025, it's make or break for the Markets",stocks,azavio,367,73,https://www.reddit.com/r/stocks/comments/1kab4qz/trump_first_100_days_ending_april_29_2025_its/
1745884944.0,2025-04-29,Is PLTR or TSLA a Better Position for AI Growth???,stocks,Fearless-Cellist-245,0,38,https://www.reddit.com/r/stocks/comments/1kaaiao/is_pltr_or_tsla_a_better_position_for_ai_growth/
1745850912.0,2025-04-28,Has everyone forgotten about logistics and infrastructure when talking about Tesla?,stocks,PlowedOyster,146,160,https://www.reddit.com/r/stocks/comments/1k9x26e/has_everyone_forgotten_about_logistics_and/
1745773427.0,2025-04-27,Volkswagen Overtakes Tesla in European EV Market for the First Time,stocks,Zhukov-74,419,45,https://www.reddit.com/r/stocks/comments/1k98ti7/volkswagen_overtakes_tesla_in_european_ev_market/
1745769161.0,2025-04-27,Big Tech’s Earnings Problem Is Estimates May Be Way Too High,stocks,WinningWatchlist,81,26,https://www.reddit.com/r/stocks/comments/1k975d5/big_techs_earnings_problem_is_estimates_may_be/
1745696547.0,2025-04-26,Elon Musk Is Running Out Of Ideas To Save Tesla,stocks,Epicurus-fan,5442,693,https://www.reddit.com/r/stocks/comments/1k8ldji/elon_musk_is_running_out_of_ideas_to_save_tesla/
1745623231.0,2025-04-25,So how does the lowered regulation for autonomous vehicles actually help Tesla achieve a profitable autonomous taxi service?,stocks,zitrored,91,60,https://www.reddit.com/r/stocks/comments/1k7yuoj/so_how_does_the_lowered_regulation_for_autonomous/
1745597459.0,2025-04-25,Google needs to change,stocks,Responsible_Bar_3306,0,59,https://www.reddit.com/r/stocks/comments/1k7osjb/google_needs_to_change/
1745596028.0,2025-04-25,Make it make sense,stocks,Synfinium,2625,523,https://www.reddit.com/r/stocks/comments/1k7o7yu/make_it_make_sense/
1745539157.0,2025-04-24,"Waymo reports 250,000 paid robotaxi rides per week in U.S.",stocks,Puginator,1315,241,https://www.reddit.com/r/stocks/comments/1k7782l/waymo_reports_250000_paid_robotaxi_rides_per_week/
1745520420.0,2025-04-24,Do you worry about concentration risk of investing in SP500?,stocks,EasternBeyond,17,82,https://www.reddit.com/r/stocks/comments/1k700s8/do_you_worry_about_concentration_risk_of/
1745512734.0,2025-04-24,Tesla Earnings: The Old Used Kleenex Trick Works Again,stocks,iD-10T_usererror,58,50,https://www.reddit.com/r/stocks/comments/1k6wu0j/tesla_earnings_the_old_used_kleenex_trick_works/
1745497751.0,2025-04-24,Which industry or market segment will be the first to actually go under the back and forth tariff game?,stocks,copyrightstriker,20,45,https://www.reddit.com/r/stocks/comments/1k6qyr6/which_industry_or_market_segment_will_be_the/
1745462199.0,2025-04-24,Tom Lee's analysis of the stock market and its outlook for the coming months.,stocks,Selection-Alert,0,29,https://www.reddit.com/r/stocks/comments/1k6hi91/tom_lees_analysis_of_the_stock_market_and_its/
1745441461.0,2025-04-23,Tesla Robotaxi - Musk sees it as infinite money hack - My crude study gets profit of $18.57 per share if it entirely displaced Uber & Lyft.,stocks,JuanPabloElTres,130,344,https://www.reddit.com/r/stocks/comments/1k6a1ck/tesla_robotaxi_musk_sees_it_as_infinite_money/
1745413797.0,2025-04-23,"Interesting Stocks Today (04/23) - Trump plans to be ""very nice"" to China!",stocks,WinningWatchlist,37,18,https://www.reddit.com/r/stocks/comments/1k5yrm0/interesting_stocks_today_0423_trump_plans_to_be/
1745358472.0,2025-04-22,Tesla CEO Musk says time he spends on DOGE will drop significantly next month,stocks,Puginator,1159,235,https://www.reddit.com/r/stocks/comments/1k5iknx/tesla_ceo_musk_says_time_he_spends_on_doge_will/
1745352789.0,2025-04-22,Tesla reports disappointing quarterly results as automotive revenue plunges 20%,stocks,Puginator,13943,979,https://www.reddit.com/r/stocks/comments/1k5g9yj/tesla_reports_disappointing_quarterly_results_as/
1745351678.0,2025-04-22,Does TSLA dare mention tariffs in its earnings call?,stocks,Objective_Chest_1697,66,22,https://www.reddit.com/r/stocks/comments/1k5ftil/does_tsla_dare_mention_tariffs_in_its_earnings/
1745336168.0,2025-04-22,Tesla Earnings: Two predictions and what to watch for after.,stocks,iD-10T_usererror,214,82,https://www.reddit.com/r/stocks/comments/1k59c6r/tesla_earnings_two_predictions_and_what_to_watch/
1745326655.0,2025-04-22,Interesting Stocks Today (04/22) - Solar Powered Tariffs!,stocks,WinningWatchlist,5,8,https://www.reddit.com/r/stocks/comments/1k55n5h/interesting_stocks_today_0422_solar_powered/
1745324742.0,2025-04-22,Tesla's Meme Stock Era: Is DJT the Next Contender?,stocks,ToothNo6373,0,11,https://www.reddit.com/r/stocks/comments/1k55075/teslas_meme_stock_era_is_djt_the_next_contender/
1745274064.0,2025-04-21,Tesla stocks going to be hammered thanks to Musk and DOGE,stocks,PrestigiousTomato8,1493,309,https://www.reddit.com/r/stocks/comments/1k4qfm5/tesla_stocks_going_to_be_hammered_thanks_to_musk/
1745270327.0,2025-04-21,Tesla shares tumble ahead of first-quarter earnings report,stocks,Puginator,919,89,https://www.reddit.com/r/stocks/comments/1k4oyql/tesla_shares_tumble_ahead_of_firstquarter/
1745269637.0,2025-04-21,"Given all that’s happened, what’s everyone’s confidence that Tesla and Elon will even report accurate numbers?",stocks,poppasquash77,539,216,https://www.reddit.com/r/stocks/comments/1k4ooux/given_all_thats_happened_whats_everyones/
1745209112.0,2025-04-21,The illusion of diversifying your portfolio,stocks,StocksTok,99,33,https://www.reddit.com/r/stocks/comments/1k44x1q/the_illusion_of_diversifying_your_portfolio/
1745203064.0,2025-04-21,How should we treat earning reports after this wild tariff?,stocks,DenchKecia,127,69,https://www.reddit.com/r/stocks/comments/1k433vw/how_should_we_treat_earning_reports_after_this/
1745144348.0,2025-04-20,Predictions for the effect of Tesla earnings on Tuesday?,stocks,BeefistPrime,199,189,https://www.reddit.com/r/stocks/comments/1k3jhq6/predictions_for_the_effect_of_tesla_earnings_on/
1745076348.0,2025-04-19,The era of American stock market exceptionalism is over,stocks,AndroidOne1,4838,598,https://www.reddit.com/r/stocks/comments/1k2ys45/the_era_of_american_stock_market_exceptionalism/
1745008943.0,2025-04-18,"Tesla to delay US launch of affordable EV, a lower-cost Model Y, sources say",stocks,callsonreddit,415,111,https://www.reddit.com/r/stocks/comments/1k2f3wb/tesla_to_delay_us_launch_of_affordable_ev_a/
1744927363.0,2025-04-17,"Tesla speeds up odometers to avoid warranty repairs, US lawsuit claims",stocks,callsonreddit,8737,330,https://www.reddit.com/r/stocks/comments/1k1p0mo/tesla_speeds_up_odometers_to_avoid_warranty/
1744920219.0,2025-04-17,Tesla Sales Drop Like A Stone In Most European Countries,stocks,SPXQuantAlgo,677,105,https://www.reddit.com/r/stocks/comments/1k1m9nt/tesla_sales_drop_like_a_stone_in_most_european/
1744836777.0,2025-04-16,Hertz shares surge more than 50% after Bill Ackman takes big stake in the rental car firm,stocks,picsit,117,41,https://www.reddit.com/r/stocks/comments/1k0v5ii/hertz_shares_surge_more_than_50_after_bill_ackman/
1744818054.0,2025-04-16,"After surge to record highs, gold overtakes 'Magnificent 7' as the most crowded trade on Wall Street",stocks,callsonreddit,448,54,https://www.reddit.com/r/stocks/comments/1k0nih7/after_surge_to_record_highs_gold_overtakes/
1744817939.0,2025-04-16,"Tesla's first-quarter registrations in California fell 15%, industry data shows",stocks,callsonreddit,1016,194,https://www.reddit.com/r/stocks/comments/1k0ngt0/teslas_firstquarter_registrations_in_california/
1744767731.0,2025-04-16,Leverage ETFs: Survive Volatility or Risk It All?,stocks,Silent_Elk7515,0,0,https://www.reddit.com/r/stocks/comments/1k08x51/leverage_etfs_survive_volatility_or_risk_it_all/
1744686020.0,2025-04-15,How bad is this for TSLA?,stocks,Much-Dealer3525,519,203,https://www.reddit.com/r/stocks/comments/1jzhipc/how_bad_is_this_for_tsla/
1744684681.0,2025-04-15,Nasdaq Technical Rebound: Entering the Final Phase,stocks,Silent_Elk7515,3,10,https://www.reddit.com/r/stocks/comments/1jzh33t/nasdaq_technical_rebound_entering_the_final_phase/
1744674684.0,2025-04-14,"Does anyone, absolutely ANY ONE think that Tesla stocks will go back up to its peak?",stocks,Big-Phase7911,0,65,https://www.reddit.com/r/stocks/comments/1jzdq04/does_anyone_absolutely_any_one_think_that_tesla/
1744505605.0,2025-04-13,"Tesla's Stock Is Set For A ""Death Cross"" On Monday",stocks,CaptainBitcoinMan,243,92,https://www.reddit.com/r/stocks/comments/1jxvwyf/teslas_stock_is_set_for_a_death_cross_on_monday/
1744469898.0,2025-04-12,Easy 10x $LCID,stocks,MrPrefrontal,0,25,https://www.reddit.com/r/stocks/comments/1jxj6cv/easy_10x_lcid/
1744403639.0,2025-04-11,Is Tesla making more money on Bitcoin investments than car sales?  Or is that fake news?,stocks,ze11ez,80,54,https://www.reddit.com/r/stocks/comments/1jwzw48/is_tesla_making_more_money_on_bitcoin_investments/
1744397052.0,2025-04-11,My father thinks he is a guru,stocks,zebirke,146,111,https://www.reddit.com/r/stocks/comments/1jwxb3h/my_father_thinks_he_is_a_guru/
1744395839.0,2025-04-11,TSLA bulls: What makes you hopeful about the company long-term and short-term?,stocks,Accurate-Toe-8409,0,20,https://www.reddit.com/r/stocks/comments/1jwwtut/tsla_bulls_what_makes_you_hopeful_about_the/
1744378254.0,2025-04-11,"Tesla stops taking new orders in China for two imported, US-made models",stocks,joe4942,171,12,https://www.reddit.com/r/stocks/comments/1jwpxko/tesla_stops_taking_new_orders_in_china_for_two/
1744352895.0,2025-04-11,3 Reasons why we reached the bottom,stocks,SwissCowOnMoon,0,24,https://www.reddit.com/r/stocks/comments/1jwjc18/3_reasons_why_we_reached_the_bottom/
1744333491.0,2025-04-11,Stephen Miran -> Hudson Bay Capital Management -> Ross Gerber,stocks,MisterBurkes,10,5,https://www.reddit.com/r/stocks/comments/1jwdu9z/stephen_miran_hudson_bay_capital_management_ross/
1744325466.0,2025-04-10,Question About Leveraged Inverse ETFs,stocks,dinkerbot3000,2,9,https://www.reddit.com/r/stocks/comments/1jwb68p/question_about_leveraged_inverse_etfs/
1744310611.0,2025-04-10,Tesla Skyrockets Over 22% In A Single Day: Massive dual blast from the ERDF annihilates bears.,stocks,iD-10T_usererror,0,13,https://www.reddit.com/r/stocks/comments/1jw5e1w/tesla_skyrockets_over_22_in_a_single_day_massive/
1744263686.0,2025-04-10,Lessons learned from yesterday,stocks,agostinho79,63,58,https://www.reddit.com/r/stocks/comments/1jvqn4k/lessons_learned_from_yesterday/
1744240688.0,2025-04-09,Tesla's director of accounting controllership resigns just days before earnings,stocks,Imploded42,498,61,https://www.reddit.com/r/stocks/comments/1jvjqqc/teslas_director_of_accounting_controllership/
1744222990.0,2025-04-09,TSLA will be at the center of tariff war with china,stocks,CMScientist,17,8,https://www.reddit.com/r/stocks/comments/1jvcvi5/tsla_will_be_at_the_center_of_tariff_war_with/
1744220184.0,2025-04-09,"Can somebody explain what happend with Tesla? I really dont understand this spike, even for a meme-stock, there was no trigger?",stocks,Adventurous-Try3603,0,83,https://www.reddit.com/r/stocks/comments/1jvbp57/can_somebody_explain_what_happend_with_tesla_i/
1744153488.0,2025-04-08,Now Shorting NVIDA or Tesla?,stocks,Adventurous-Try3603,0,34,https://www.reddit.com/r/stocks/comments/1jur9d4/now_shorting_nvida_or_tesla/
1744140861.0,2025-04-08,Why is NASDAQ getting hammered more than Dow or SP500,stocks,Bright_Office_9792,0,21,https://www.reddit.com/r/stocks/comments/1jumdyj/why_is_nasdaq_getting_hammered_more_than_dow_or/
1744129153.0,2025-04-08,"Forbes: ""Elon Musk's pet project- the dumpster driving Tesla Cybertruck..."" is one of biggest flops in automotive history.",stocks,iD-10T_usererror,301,43,https://www.reddit.com/r/stocks/comments/1juhkut/forbes_elon_musks_pet_project_the_dumpster/
1744125825.0,2025-04-08,Tesla stock price is still higher than it was roughly 6 months ago,stocks,alpastoor,26,17,https://www.reddit.com/r/stocks/comments/1jug8h6/tesla_stock_price_is_still_higher_than_it_was/
1744102589.0,2025-04-08,Demand for U S goods,stocks,silverminer49er,10,14,https://www.reddit.com/r/stocks/comments/1ju90gk/demand_for_u_s_goods/
1744100013.0,2025-04-08,Elon Musk appealed to Trump to reverse sweeping trade tariffs,stocks,SPXQuantAlgo,460,54,https://www.reddit.com/r/stocks/comments/1ju8gln/elon_musk_appealed_to_trump_to_reverse_sweeping/
1744067493.0,2025-04-07,Leveraged Bets Dominate Trading in Tariff Rout Like Never Before,stocks,joe4942,0,4,https://www.reddit.com/r/stocks/comments/1jtz5h4/leveraged_bets_dominate_trading_in_tariff_rout/
1744064581.0,2025-04-07,Apple’s 3-day loss in market cap swells to almost $640 billion,stocks,Puginator,302,45,https://www.reddit.com/r/stocks/comments/1jty3gi/apples_3day_loss_in_market_cap_swells_to_almost/
1743966722.0,2025-04-06,"Tesla bull slashes stock price target 43%, citing Musk and Trump",stocks,callsonreddit,347,76,https://www.reddit.com/r/stocks/comments/1jt1wlc/tesla_bull_slashes_stock_price_target_43_citing/
1743909626.0,2025-04-06,Just started investing at 22 – stressed about Monday,stocks,medic1456,0,24,https://www.reddit.com/r/stocks/comments/1jskw1e/just_started_investing_at_22_stressed_about_monday/
1743850842.0,2025-04-05,"Another wealth transfer since 2008 crash, S&P 500 loses another $5 trillion in just two days.",stocks,_chai_satire_,1329,181,https://www.reddit.com/r/stocks/comments/1js0x5d/another_wealth_transfer_since_2008_crash_sp_500/
1743820116.0,2025-04-05,Companies with a large footprint in the US should benefit from the tariffs?,stocks,Andrew878D,0,20,https://www.reddit.com/r/stocks/comments/1jrtaam/companies_with_a_large_footprint_in_the_us_should/
1743819844.0,2025-04-05,Is Black Monday Incoming?,stocks,Chrissylumpy21,1995,1061,https://www.reddit.com/r/stocks/comments/1jrt7er/is_black_monday_incoming/
1743812485.0,2025-04-05,Rocket Lab vs SpaceX: The Anti‑Musk Space Investment Campaign,stocks,cheese_and_toasted,13,11,https://www.reddit.com/r/stocks/comments/1jrqwdb/rocket_lab_vs_spacex_the_antimusk_space/
1743809655.0,2025-04-04,Technology stocks,stocks,I_hate_ElonMusk,1,5,https://www.reddit.com/r/stocks/comments/1jrpy8l/technology_stocks/
1743805560.0,2025-04-04,Market downturn trigger?,stocks,bagodeadcats,0,10,https://www.reddit.com/r/stocks/comments/1jroid1/market_downturn_trigger/
1743791601.0,2025-04-04,What happens on Monday,stocks,badharp,190,345,https://www.reddit.com/r/stocks/comments/1jrj3gr/what_happens_on_monday/
1743770818.0,2025-04-04,What Musk Leaving DOGE Would Mean for Tesla Stock,stocks,MolassesCalm4876,0,12,https://www.reddit.com/r/stocks/comments/1jrb0tf/what_musk_leaving_doge_would_mean_for_tesla_stock/
1743738143.0,2025-04-04,Top Ten Nasdaq Point Drops in Chronological Order and Trading Days to Recover,stocks,Haidian-District,38,31,https://www.reddit.com/r/stocks/comments/1jr2mj4/top_ten_nasdaq_point_drops_in_chronological_order/
1743704032.0,2025-04-03,"Apple sheds $300 billion in tariff-fueled sell-off, on track for worst drop since March 2020",stocks,callsonreddit,215,63,https://www.reddit.com/r/stocks/comments/1jqpre5/apple_sheds_300_billion_in_tarifffueled_selloff/
1743697421.0,2025-04-03,ADVICE: Any stocks worth investing it right now?,stocks,mpatal,14,80,https://www.reddit.com/r/stocks/comments/1jqmuwh/advice_any_stocks_worth_investing_it_right_now/
1743689524.0,2025-04-03,RDDT plunges… why?,stocks,DrCalFun,0,27,https://www.reddit.com/r/stocks/comments/1jqjhyd/rddt_plunges_why/
1743682528.0,2025-04-03,Why a China–Korea–Japan Free Trade Deal Would Be a Huge Win for BYD,stocks,likemastatus,49,32,https://www.reddit.com/r/stocks/comments/1jqgunf/why_a_chinakoreajapan_free_trade_deal_would_be_a/
1743637058.0,2025-04-02,Elon Needs to Resign as Tesla CEO Before It’s Too Late,stocks,Obvious_Shoe7302,0,47,https://www.reddit.com/r/stocks/comments/1jq3e8b/elon_needs_to_resign_as_tesla_ceo_before_its_too/
1743609392.0,2025-04-02,Rivian posts sharp fall in quarterly deliveries as soft demand weighs,stocks,callsonreddit,102,24,https://www.reddit.com/r/stocks/comments/1jps3gk/rivian_posts_sharp_fall_in_quarterly_deliveries/
1743599756.0,2025-04-02,Interesting Stocks Today (04/2),stocks,WinningWatchlist,6,6,https://www.reddit.com/r/stocks/comments/1jpoamx/interesting_stocks_today_042/
1743599400.0,2025-04-02,"Tesla reports 336,000 vehicle deliveries in first quarter",stocks,Puginator,918,434,https://www.reddit.com/r/stocks/comments/1jpo69r/tesla_reports_336000_vehicle_deliveries_in_first/
1743587489.0,2025-04-02,The Folksam Group (Sweden) is selling its entire shareholding in Tesla,stocks,DzipaloJunuzHepek,1067,45,https://www.reddit.com/r/stocks/comments/1jpks8j/the_folksam_group_sweden_is_selling_its_entire/
1743576435.0,2025-04-02,"Tesla Hidey Hole (Richmond, VA)- Don't believe the numbers tomorrow but the ERDF is real.",stocks,iD-10T_usererror,230,123,https://www.reddit.com/r/stocks/comments/1jpicww/tesla_hidey_hole_richmond_va_dont_believe_the/
1743493902.0,2025-04-01,"Tesla car sales in France, Sweden drop to lowest first-quarter in four years",stocks,SPXQuantAlgo,733,112,https://www.reddit.com/r/stocks/comments/1joq631/tesla_car_sales_in_france_sweden_drop_to_lowest/
1743464717.0,2025-03-31,Stocks close out their worst quarter since 2022 amid tariff uncertainty,stocks,PrestigiousZombie726,142,34,https://www.reddit.com/r/stocks/comments/1joht47/stocks_close_out_their_worst_quarter_since_2022/
1743442672.0,2025-03-31,Elon Musk says backlash against his DOGE government cuts is hurting Tesla stock,stocks,Puginator,3223,572,https://www.reddit.com/r/stocks/comments/1jo91nk/elon_musk_says_backlash_against_his_doge/
1743431871.0,2025-03-31,Tesla shares drop as Stifel slashes PT and delivery forecasts,stocks,SPXQuantAlgo,574,118,https://www.reddit.com/r/stocks/comments/1jo4ptx/tesla_shares_drop_as_stifel_slashes_pt_and/
1743426201.0,2025-03-31,Interesting Stocks Today (03/31),stocks,WinningWatchlist,2,2,https://www.reddit.com/r/stocks/comments/1jo2ogp/interesting_stocks_today_0331/
1743397603.0,2025-03-31,Why is Tesla Worth Anything?,stocks,Unfair_Net9070,485,406,https://www.reddit.com/r/stocks/comments/1jnvqnv/why_is_tesla_worth_anything/
1743352654.0,2025-03-30,Challenging the Noise: A Closer Look at Tesla's Q1 Projections,stocks,TheiaFintech,34,87,https://www.reddit.com/r/stocks/comments/1jngg3e/challenging_the_noise_a_closer_look_at_teslas_q1/
1743171062.0,2025-03-28,TSLA - Premliminary Tesla registration numbers from March 2025 in Europe.,stocks,wonderboy-75,136,84,https://www.reddit.com/r/stocks/comments/1jlvzdl/tsla_premliminary_tesla_registration_numbers_from/
1743115861.0,2025-03-27,Better news alternative than Schwab?,stocks,Ok_Promotion3741,31,38,https://www.reddit.com/r/stocks/comments/1jlg8tj/better_news_alternative_than_schwab/
1743057254.0,2025-03-27,Elon Musk Is One of the Few Winners From Trump Auto Tariffs,stocks,joe4942,3967,184,https://www.reddit.com/r/stocks/comments/1jkxq24/elon_musk_is_one_of_the_few_winners_from_trump/
1743026772.0,2025-03-26,"Tesla shares drop on plunging European sales, concerns about Trump's tariffs",stocks,Puginator,1519,74,https://www.reddit.com/r/stocks/comments/1jko4ew/tesla_shares_drop_on_plunging_european_sales/
1743006939.0,2025-03-26,Stop pretending you know the market,stocks,Hot-Respond-7988,909,304,https://www.reddit.com/r/stocks/comments/1jkg3ak/stop_pretending_you_know_the_market/
1742995332.0,2025-03-26,Interesting Stocks Watchlist (03/26) - GME follows MicroStrategy's Strategy,stocks,WinningWatchlist,16,34,https://www.reddit.com/r/stocks/comments/1jkbnag/interesting_stocks_watchlist_0326_gme_follows/
1742978072.0,2025-03-26,If Tesla share price is objectively absurd then why is short interest at only 2% -3%?,stocks,Razzzclart,400,612,https://www.reddit.com/r/stocks/comments/1jk72ln/if_tesla_share_price_is_objectively_absurd_then/
1742969961.0,2025-03-26,"Google is the most innovative, technologically advanced out of all the Mag 7 companies",stocks,This-Complex-669,427,297,https://www.reddit.com/r/stocks/comments/1jk5bl5/google_is_the_most_innovative_technologically/
1742940850.0,2025-03-25,Stocks Close Higher for 3rd Straight Day; Tesla Surges in Late Trading to Extend Rally,stocks,BogleDick,47,106,https://www.reddit.com/r/stocks/comments/1jjvzui/stocks_close_higher_for_3rd_straight_day_tesla/
1742937762.0,2025-03-25,"Canada Freezes $43 Million in Tesla EV Rebates, Bans Future Eligibility Over Tariff Dispute",stocks,DPH_NS,1354,80,https://www.reddit.com/r/stocks/comments/1jjurav/canada_freezes_43_million_in_tesla_ev_rebates/
1742929799.0,2025-03-25,Chinese EV giant BYD outpaces Tesla with annual sales of more than $100 billion,stocks,Puginator,546,85,https://www.reddit.com/r/stocks/comments/1jjrhhe/chinese_ev_giant_byd_outpaces_tesla_with_annual/
1742923555.0,2025-03-25,Financial times tones down its claims about a $1.4 billion misstatement in Tesla's cash flow,stocks,SPXQuantAlgo,478,132,https://www.reddit.com/r/stocks/comments/1jjowow/financial_times_tones_down_its_claims_about_a_14/
1742919169.0,2025-03-25,Tesla just got even more bad news from Europe,stocks,Hiversitize,4684,542,https://www.reddit.com/r/stocks/comments/1jjn4aa/tesla_just_got_even_more_bad_news_from_europe/
